Level_Code,University,City,Course,Faculty,Local_Fees,Int_Fees,Currency,Currency_Time,Duration,Duration_Time,Full_Time,Part_Time,Prerequisite_1,Prerequisite_2,Prerequisite_3,Prerequisite_1_grade_1,Prerequisite_2_grade_2,Prerequisite_3_grade_3,Website,Course_Lang,Availability,Description,Career_Outcomes/path,Country,Online,Offline,Distance,Face_to_Face,Blended,Remarks
BA,Edith Cowan University,Perth,Bachelor of Science (Exercise Science and Rehabilitation),Science,"9,050","34,750",AUD,Years,4.0,Years,Yes,No,ATAR,IELTS,Equivalent ,80,6.0,Year 12,https://www.ecu.edu.au/degrees/courses/bachelor-of-science-exercise-science-and-rehabilitation,English,A,"Provides students with the opportunity to gain knowledge, skills and experience in clinical exercise delivery, healthy lifestyle intervention and wellness programs for people living with chronic conditions or injuries, and the healthy population.",,Australia,No,Yes,No,Yes,No,
BA,Edith Cowan University,Perth,Bachelor of Science (Marine and Freshwater Biology),Science,"9,700","35,000",AUD,Years,3.0,Years,Yes,No,ATAR,IELTS,Equivalent ,70,6.0,Year 12,https://www.ecu.edu.au/degrees/courses/bachelor-of-science-marine-and-freshwater-biology,English,A,There is an emphasis on the continuity of these environments across the transition from freshwater to estuarine and into marine systems. Students develop skills that are required to understand and manage such systems. Students benefit from a learning environment inspired by world class research academics with strong industry and government links.,"Marine Scientist, Aquatic Biologist, Marine Park Manager, Marine Biologist, Environmental Officer, Water Manager, Catchment Coordinator, Aquatic Scientist, Natural Resource Manager, Fisheries Officer",Australia,No,Yes,No,Yes,No,
BA,Edith Cowan University,Perth,Bachelor of Science (Nursing Studies),Science,"6,850","35,550",AUD,Years,3.0,Years,Yes,Yes,ATAR,IELTS,Equivalent ,70,6.0,Year 12,https://www.ecu.edu.au/degrees/courses/bachelor-of-science-nursing-studies,English,A,The course is not professionally-accredited and therefore does not lead to registration with the Nurses and Midwives Board of Australia.,,Australia,Yes,Yes,Yes,Yes,Yes,
BA,Edith Cowan University,Bunbury,Bachelor of Science (Nursing Studies),Science,"6,850","35,550",AUD,Years,3.0,Years,Yes,Yes,ATAR,IELTS,Equivalent ,70,6.0,Year 12,https://www.ecu.edu.au/degrees/courses/bachelor-of-science-nursing-studies,English,A,The course is not professionally-accredited and therefore does not lead to registration with the Nurses and Midwives Board of Australia.,,Australia,Yes,Yes,Yes,Yes,Yes,
BA,Edith Cowan University,Perth,Bachelor of Science (Nursing),Science,"7,200","35,450",AUD,Years,3.0,Years,Yes,No,ATAR,IELTS,Equivalent ,70,6.0,Year 12,https://www.ecu.edu.au/degrees/courses/bachelor-of-science-nursing,English,A,The course is designed to enable graduates to be well prepared to make significant contributions to the outcomes of patients within a diverse range of health care settings.,,Australia,No,Yes,No,Yes,No,
BA,Edith Cowan University,Bunbury,Bachelor of Science (Nursing),Science,"7,200","35,450",AUD,Years,3.0,Years,Yes,No,ATAR,IELTS,Equivalent ,70,6.0,Year 12,https://www.ecu.edu.au/degrees/courses/bachelor-of-science-nursing,English,A,The course is designed to enable graduates to be well prepared to make significant contributions to the outcomes of patients within a diverse range of health care settings.,,Australia,No,Yes,No,Yes,No,
BA,Edith Cowan University,Perth,Bachelor of Science (Nursing) Bachelor of Science (Midwifery),Science,"8,900","44,350",AUD,Years,4.0,Years,Yes,No,ATAR,IELTS,Equivalent ,75,6.0,Year 12,https://www.ecu.edu.au/degrees/courses/bachelor-of-science-nursing-bachelor-of-science-midwifery,English,A,"The course offers an innovative and broad study approach, with graduates ready for beginning level practice in both midwifery and nursing. It provides students with the knowledge and skills to deliver high quality care within the healthcare environment. ",,Australia,No,Yes,No,Yes,No,
BA,Edith Cowan University,Bunbury,Bachelor of Science (Nursing) Bachelor of Science (Midwifery),Science,"8,900","44,350",AUD,Years,4.0,Years,Yes,No,ATAR,IELTS,Equivalent ,75,6.0,Year 12,https://www.ecu.edu.au/degrees/courses/bachelor-of-science-nursing-bachelor-of-science-midwifery,English,A,"The course offers an innovative and broad study approach, with graduates ready for beginning level practice in both midwifery and nursing. It provides students with the knowledge and skills to deliver high quality care within the healthcare environment. ",,Australia,No,Yes,No,Yes,No,
BA,Edith Cowan University,Perth,Bachelor of Science (Occupational Therapy),Science,"10,150","34,200",AUD,Years,4.0,Years,Yes,No,ATAR,IELTS,Equivalent ,80,6.0,Year 12,https://www.ecu.edu.au/degrees/courses/bachelor-of-science-occupational-therapy,English,A,"Fieldwork placements commence in the first year and throughout the course, and provide students with valuable learning experiences in a range of settings. Graduates will possess a sound knowledge and understanding of professional principles and processes and will be able to generalise their attributes and skills in new situations. Students with a Weighted Average Mark (WAM) of 70 per cent or higher after the third year of study may be invited to complete an Honours program within the fourth year. Those students will transfer to the Bachelor of Science (Occupational Therapy) Honours for the fourth and final year.",,Australia,No,Yes,No,Yes,No,
BA,Edith Cowan University,Perth,Bachelor of Science (Paramedical Science),Science,"10,350","34,700",AUD,Years,3.0,Years,Yes,No,ATAR,IELTS,Equivalent ,70,6.0,Year 12,https://www.ecu.edu.au/degrees/courses/bachelor-of-science-paramedical-science,English,A,"Students will develop an understanding of professional and ethical practice, communication and safe practice within the public health, social, cultural and clinical paramedical science environments.","Paramedic, Critical Care Paramedic, Community Paramedic, Industrial Paramedic, Ambulance Officer, Intensive Care Paramedic, Retrieval Paramedic",Australia,Yes,Yes,Yes,Yes,No,
BA,Edith Cowan University,Perth,Bachelor of Science (Security),Science,"9,350","35,200",AUD,Years,3.0,Years,Yes,Yes,ATAR,IELTS,Equivalent ,70,6.0,Year 12,https://www.ecu.edu.au/degrees/courses/bachelor-of-science-security,English,A,"The course emphasizes the diagnosis of security concerns through a risk approach. Then the development of the security strategy applying theories and principles of security before commissioning and ongoing management of the protection solution. It is supported by appropriate studies in technology, law and ethics. ","Security Manager, Corporate Security Manager, Security Consultant, Security Engineer, Critical Infrastructure Manager, Organisational Security Manager, Security Systems Manager, Security Analyst, Security Auditor, Risk and Security Manager",Australia,Yes,Yes,Yes,Yes,Yes,
HONS,Edith Cowan University,Perth,Bachelor of Science Honours,Science,"9,150","34,700",AUD,Years,1.0,Year,Yes,No,ATAR,IELTS,Equivalent , ,6.0,Year 12,https://www.ecu.edu.au/degrees/courses/bachelor-of-science-honours,English,A,"Ideal for students interested in independent research, this course involves a research thesis on the student's topic of choice, preparing them for a scientific research career.",,Australia,No,Yes,No,Yes,No,
BA,Edith Cowan University,Perth,Bachelor of Science Bachelor of Commerce,Science,"10,550","32,800",AUD,Years,4.0,Years,Yes,No,ATAR,IELTS,Equivalent ,70,6.0,Year 12,https://www.ecu.edu.au/degrees/courses/bachelor-of-science-bachelor-of-commerce,English,A,"The four years include concurrent study in both disciplines, with students choosing one major in science and another in commerce. The course provides multiple possibilities for international study and/or exchange, and a choice of electives to broaden knowledge and skills.","Sustainability Officer, Climate Change Adaptation Manager, Scientific Consultant, Government Scientist, Scientific Adviser, Business Manager, Business Consultant/Adviser, Marketing Officer",Australia,No,Yes,No,Yes,No,
BA,Edith Cowan University,Perth,Bachelor of Social Science,Science,"6,850","33,000",AUD,Years,3.0,Years,Yes,Yes,ATAR,IELTS,Equivalent ,70,6.0,Year 12,https://www.ecu.edu.au/degrees/courses/bachelor-of-social-science,English,A,"This course equips you with an understanding of how society works and how you can make a positive change. You learn to analyse, challenge and gain insight into globally significant theories about class, race, work, social justice, gender, family and communities. You will also explore the exciting complexities of the human social experience and armed with these in-depth insights, you can help policy makers find the right solutions to improve the society in which we exist.","Community Worker, Community Development Officer, Policy Officer, Family Support Officer, Parent Education Coordinator, Project Officer",Australia,Yes,Yes,Yes,Yes,Yes,
BA,Edith Cowan University,Bunbury,Bachelor of Social Work,Arts and Humanities,"6,850","30,800",AUD,Years,4.0,Years,Yes,No,ATAR,IELTS,Equivalent ,70,6.0,Year 12,https://www.ecu.edu.au/degrees/courses/bachelor-of-social-work,English,A,"Students undertake studies in social work theory and practice, research, politics, policy, law, and ethics, with particular reference to the relevance of this knowledge to practise in regional, rural and remote settings. This is an entry qualification into the social work profession and has been determined to meet the Australian Social Work Education and Accreditation Standards of the Australian Association of Social Workers (AASW). ",,Australia,Yes,Yes,Yes,Yes,No,
BA,Edith Cowan University,Perth,Bachelor of Speech Pathology,Medical and Health Sciences,"9,050","36,300",AUD,Years,4.0,Years,Yes,No,ATAR,IELTS,Equivalent ,80,6.0,Year 12,https://www.ecu.edu.au/degrees/courses/bachelor-of-speech-pathology,English,A,"Speech Pathologists provide diagnostic assessment and management of disorders of communication and swallowing for people of all ages, from babies to the elderly. They work with a wide range of problems like stuttering, voice problems, language disorders and physical and intellectual disabilities. If you are passionate about communicating, have an interest in helping people across the lifespan, this might be a career for you. Speech Pathology includes science, communication and being creative in planning therapy. One of the best things about studying Speech Pathology at ECU is starting your practical experience in your first year. And with our smaller student cohort and greater personal attention you’ll receive from our experienced lecturers, it’s the best way to start your new career. ",Speech Pathologist,Australia,No,Yes,No,Yes,No,
BA,Edith Cowan University,Perth,"Bachelor of Sport, Recreation and Event Management",Business and Law,"10,100","31,850",AUD,Years,3.0,Years,Yes,No,ATAR,IELTS,Equivalent ,70,6.0,Year 12,https://www.ecu.edu.au/degrees/courses/bachelor-of-sport-recreation-and-event-management,English,A,"This course commences with an introduction to the sport, recreation and event sector and focuses on the key aspects of sport delivery systems, event management, leadership and programming, culture and professional identity development, sport and recreation facilities and services management, strategic and human resource management, marketing and communications, funding and finance, sport venue management, event operations management, legal aspects, and business research and planning. Students also undertake a range of professional industry practice opportunities, and community-interactive project work in the relevant industries. Students have the opportunity to further specialise their studies with a stronger industry focus in various fields, such as marketing, sports science, human resource management, public relations, or tourism and hospitality management. Students graduate ready to enter the fast-paced and dynamic sport, recreation and events sector, having learnt the industry-focused theoretical knowledge and practical skills required to succeed.","Sport and Recreation Event Manager, Recreation Services Manager, Sport Association CEO, Sport Development Manager, Sport Marketing and Sponsorship Manager, Sport Corporate Affairs Manager, Sport Communications Manager, Sport Membership Manager, Sport Club Manager, Player Manager",Australia,Yes,Yes,Yes,Yes,No,
BA,Edith Cowan University,Perth,Bachelor of Sustainability,Science,"9,050","33,800",AUD,Years,3.0,Years,Yes,No,ATAR,IELTS,Equivalent ,70,6.0,Year 12,https://www.ecu.edu.au/degrees/courses/bachelor-of-sustainability,English,A,"To meet this challenge, society will need graduates with an awareness and understanding of disciplines from across environmental, social and economic domains. The environmental domain covers the water, air and soil and the biota that inhabit them, while the economic domain deals with the financial and managerial aspects of business and resource decisions. The social domain recognises that people are both the cause of and solution to sustainability issues. Students will receive practical and theoretical guidance in a set of skills that are essential for solving problems: systems thinking, critical thinking, and decision-making, and will build personal attributes that will enable them to work in teams to generate new ideas, and new solutions. Studies will include an emphasis on field-based exercises and workplace learning.","Sustainability Officer, Sustainability Practitioner, Sustainability Consultant, Government Officer, Scientific Adviser",Australia,No,Yes,No,Yes,No,
BA,Edith Cowan University,Perth,Bachelor of Technology (Aeronautical),Engineering,"9,700","31,400",AUD,Years,3.0,Years,Yes,No,ATAR,IELTS,Equivalent ,70,6.0,Year 12,https://www.ecu.edu.au/degrees/courses/bachelor-of-technology-aeronautical,English,A,"The only course of its kind in Western Australia, aeronautical technology deals with the science and technology of aviation, including aircraft systems, materials and manufacturing technology, and aircraft operation. Areas of study include a foundation in science and mathematics, along with engineering mechanics, computer-aided design, engineering materials, and thermodynamics and fluids. It also covers specific aviation science subjects such as aircraft systems and structures, aircraft propulsion and aerodynamics. Students will also gain an understanding of the operation and performance of aircraft from the point-of-view of an aviation technologist. The course focuses on the development of knowledge and skills relevant to the aviation industry, and, along with a sound theoretical base, includes strong elements of practical problem-solving, team work and project work. As a result, students will have multiple technical and transferable skill competencies, and will graduate with strong analytical skills and the ability to contribute to complex projects. Provided appropriate electives are chosen, graduating students can apply to articulate into ECU's Master of Engineering course, specialising in either Mechanical or Civil Engineering. This enables students to achieve professional engineer status after a further two years of study.",,Australia,No,Yes,No,Yes,No,
BA,Edith Cowan University,Perth,Bachelor of Technology (Electronic and Computer Systems),Science,"9,700","31,450",AUD,Years,3.0,Years,Yes,No,ATAR,IELTS,Equivalent ,70,6.0,Year 12,https://www.ecu.edu.au/degrees/courses/bachelor-of-technology-electronic-and-computer-systems,English,A,Provides a pathway for students who wish to pursue a career as a technologist in the fields of electronics or computer systems.,,Australia,No,Yes,No,Yes,No,
BA,Edith Cowan University,Perth,Bachelor of Technology (Engineering),Engineering,"9,700","31,450",AUD,Years,3.0,Years,Yes,No,ATAR,IELTS,Equivalent ,70,6.0,Year 12,https://www.ecu.edu.au/degrees/courses/bachelor-of-technology-engineering,English,A,This course can also be used as a pathway to the Bachelor of Engineering Honours courses.,"Engineering Technologist, Engineering Technician",Australia,No,Yes,No,Yes,No,
BA,Edith Cowan University,Perth,Bachelor of Technology (Motorsports),Medical and Health Sciences,"9,700","31,500",AUD,Years,3.0,Years,Yes,No,ATAR,IELTS,Equivalent ,70,6.0,Year 12,https://www.ecu.edu.au/degrees/courses/bachelor-of-technology-motorsports,English,A,"Students gain a solid understanding of the design, simulation and fabrication processes, and the management issues associated with production of the complex automotive systems and the components that underpin the motorsport industry. The course provides a stimulating and supportive learning environment, with an enthusiastic and articulate approach that reflects the culture of motorsports. Students also have the opportunity to further develop competencies through the provision of extra-curricular activities to help progression into the motorsports industry. Applicants from South West WA will be able to study only the first year (up to eight foundation units) of this degree at ECU's Bunbury Campus, which may include attending a short set of lab sessions at Joondalup Campus by the end of each semester. After completing these eight units, Bunbury students will need to attend ECU's Joondalup Campus to complete the rest of their course. This option is only available for domestic students living in the South West region of WA.","Automotive Technologist, Mechanical Technologist",Australia,No,Yes,No,Yes,No,
BA,Edith Cowan University,Perth,Bachelor of Youth Work,Arts and Humanities,"8,300","33,450",AUD,Years,3.0,Years,Yes,No,ATAR,IELTS,Equivalent ,70,6.0,Year 12,https://www.ecu.edu.au/degrees/courses/bachelor-of-youth-work,English,A,"Students can choose complementary areas of study such as Aboriginal and Intercultural Studies, Addiction Studies, Community Work, Criminology, Psychology, Counselling, Visual Arts, Media and Communication, Events Management, and Outdoor Adventure.","Youth Worker, Youth Support Worker, Youth Development Officer, Youth Activities Officer, Youth Welfare Worker, Youth and Family Mediation, Youth Health Educator, Youth Policy Officer, Youth Outreach Worker, Youth Engagement Worker, Youth Mental Health Worker, School Chaplain, Youth Mental Health Care Coordinator, Youth and Community Worker, Community Education Worker (Youth), Youth Officer, Youth Liaison Worker, School Retention and Participation Officer.",Australia,Yes,Yes,Yes,Yes,No,
BA,Edith Cowan University,Perth,Certificate IV in Aboriginal Performance,Western Australian Academy of Performing Arts, , ,AUD,Years,1.0,Year,Yes,Yes,ATAR,IELTS,Equivalent , ,6.0,Year 12,https://www.ecu.edu.au/degrees/courses/certificate-iv-in-aboriginal-performance,English,D,"Successful students will also have a basic knowledge of indigenous culture as it relates to performance and understand the communication skills required to audition for roles in theatre, television and film. ",,Australia,No,Yes,No,Yes,No,
DIP,Edith Cowan University,Perth,Diploma of Acting,Western Australian Academy of Performing Arts, , ,AUD,Years,1.0,Year,Yes,Yes,ATAR,IELTS,Equivalent , ,6.0,Year 12,https://www.ecu.edu.au/degrees/courses/diploma-of-acting,English,D,"On successful completion of the course, students will have integrated theatre acting, voice, movement, and industry practice into a tangible performance skill, acquired knowledge of script analysis in the context of acting for theatre, and be cognisant of the communication and pre-professional skills necessary to audition for and perform roles in theatre. ",,Australia,No,Yes,No,Yes,No,
DIP,Edith Cowan University,Perth,Diploma of Dance (Elite Performance),Western Australian Academy of Performing Arts, , ,AUD,Years,1.0,Year,Yes,Yes,ATAR,IELTS,Equivalent , ,6.0,Year 12,https://www.ecu.edu.au/degrees/courses/diploma-of-dance-elite-performance,English,D,"The course provides intense technical training and develops stylistic/artistic expression through practical experience, classes and performance opportunities. Students develop technical and creative skills in discipline areas of ballet, pointe, pas de deux and solos, contemporary techniques, choreography, dance history, music for dance, anatomy, nutrition and fitness.",,Australia,No,Yes,No,Yes,No,
DIP,Edith Cowan University,Perth,Diploma of Environmental Health,Science,"9,700", ,AUD,Years,1.0,Year,Yes,Yes,ATAR,IELTS,Equivalent , ,6.0,Year 12,https://www.ecu.edu.au/degrees/courses/diploma-of-environmental-health,English,D,"Students graduate with the ability to think critically about prevention and control of communicable and environmental disease and a range of other environmental health issues, to work independently and as part of a team, and plan and coordinate environmental health projects. ","Environmental Health Assistant, Environmental Health Cadet, Environmental Health Technical Officer",Australia,Yes,Yes,Yes,Yes,No,
DIP,Edith Cowan University,Bunbury,Diploma of Environmental Health,Science,"9,700", ,AUD,Years,1.0,Year,Yes,Yes,ATAR,IELTS,Equivalent , ,6.0,Year 12,https://www.ecu.edu.au/degrees/courses/diploma-of-environmental-health,English,D,"Students graduate with the ability to think critically about prevention and control of communicable and environmental disease and a range of other environmental health issues, to work independently and as part of a team, and plan and coordinate environmental health projects. ","Environmental Health Assistant, Environmental Health Cadet, Environmental Health Technical Officer",Australia,Yes,Yes,Yes,Yes,No,
DIP,Edith Cowan University,Perth,Diploma of Live Production and Technical Services,Western Australian Academy of Performing Arts, , ,AUD,Years,1.0,Year,Yes,Yes,ATAR,IELTS,Equivalent , ,6.0,Year 12,https://www.ecu.edu.au/degrees/courses/diploma-of-live-production-and-technical-services,English,D,"This course may appeal to those who have an interest in design, lighting, props, scenery, stage management and similar aspects of production. The course is structured to provide skills and experience consistent with the growing needs of the entertainment industry. Students work as directed on productions mounted by WAAPA and begin by assisting, until sufficiently skilled, to perform designated tasks. In the final year of the program, students will be expected to provide service at a professional level of competence.","Scenic Designer, Costume Designer, Stylist, Art Finisher, Costumier, Dresser, Film Standby, Milliner, Muralist, Stage Manager",Australia,No,Yes,No,Yes,No,
DIP,Edith Cowan University,Perth,Diploma of Music Industry,Western Australian Academy of Performing Arts, , ,AUD,Years,1.0,Year,Yes,Yes,ATAR,IELTS,Equivalent , ,6.0,Year 12,https://www.ecu.edu.au/degrees/courses/diploma-of-music-industry,English,D,"As well as gaining essential theoretical knowledge, students will be assessed on their understanding of the specialised, technical and managerial competencies required to work in the music industry. Students learn in a multi-disciplinary performing arts academy, and have access to hundreds of outstanding performances over the course of the year. Within the course students can specialise in Composition, Sound Production or Performance (Classical, Jazz, Contemporary Performance, or Contemporary Music Artist). ","Musician, Performance Artist, Composer, Performer, Entertainer, Sound Recordist, Sound Designer, Sound Engineer, Sound Mixer",Australia,No,Yes,No,Yes,No,
DIP,Edith Cowan University,Perth,Diploma of Musical Theatre,Western Australian Academy of Performing Arts, , ,AUD,Years,1.0,Year,Yes,Yes,ATAR,IELTS,Equivalent , ,6.0,Year 12,https://www.ecu.edu.au/degrees/courses/diploma-of-musical-theatre,English,D,"Students will develop skills in acting, singing and dancing, and the important integration of all three, through highly practical classes and production projects.","Actor, Singer, Performer, Entertainer, Dancer",Australia,No,Yes,No,Yes,No,
DIP,Edith Cowan University,Perth,Diploma of Screen Performance,Western Australian Academy of Performing Arts, , ,AUD,Years,1.0,Year,Yes,Yes,ATAR,IELTS,Equivalent , ,6.0,Year 12,https://www.ecu.edu.au/degrees/courses/diploma-of-screen-performance,English,D,"On successful completion of the course, students will have combined screen acting, storytelling, and industry practice into a tangible performance skill; acquired a basic knowledge of camera operation and script analysis in the context of screen performance; and understand the communication and pre-professional skills necessary to audition for and perform roles in television and film.","actor, film and television actor, performer, screen actor",Australia,No,Yes,No,Yes,No,
SHORT COURSES,Edith Cowan University,Perth,Indigenous University Orientation Course,Kurongkurl Katitjin, , ,AUD,Years,,,Yes,Yes,ATAR,IELTS,Equivalent , ,6.0,Year 12,https://www.ecu.edu.au/degrees/courses/indigenous-university-orientation-course,English,D,"Additionally, students will be introduced to university life at ECU and will have access to course and career advice to assist in making informed decisions about undergraduate degree selection. The course is suitable for recent school leavers and mature age students who have not previously studied at university.",,Australia,Yes,Yes,Yes,Yes,No,
