Level_Code,University,City,Course,Faculty,Local_Fees,Int_Fees,Currency,Currency_Time,Duration,Duration_Time,Full_Time,Part_Time,Prerequisite_1,Prerequisite_2,Prerequisite_3,Prerequisite_1_grade_1,Prerequisite_2_grade_2,Prerequisite_3_grade_3,Website,Course_Lang,Availability,Description,Career_Outcomes/path,Country,Online,Offline,Distance,Face_to_Face,Blended,Remarks
HONS,Edith Cowan University,Perth,Bachelor of Engineering (Electrical Power) Honours,Engineering,"9,700","31,500",AUD,Years,4.0,Years,Yes,No,ATAR,IELTS,Equivalent ,82,6.0,Year 12,https://www.ecu.edu.au/degrees/courses/bachelor-of-engineering-electrical-power-honours,English,A,"The course provides broad coverage across a range of core electrical and electronic subjects, leading to more in-depth studies of power systems including generation, transmission and protection, as well as power electronics, electromechanical systems, industrial control, and renewable energy. The program focuses on the development of knowledge and skills relevant to professional engineering practice and along with a sound theoretical base, includes strong elements of practical problem solving, team work and project development. As a result, as well as having multiple technical and transferable skill competencies, graduates will gain strong analytical skills, and have the ability to lead complex projects. The course provides a sound basis in mechanics, dynamics, mathematics, and the principles of engineering design in the first two years of study, along with a broad basis in engineering science including materials and manufacturing, computer aided design, programming principles, and analogue and digital electronics. In the final two years of study, a range of specialist electrical power engineering topics are covered to prepare students to enter their chosen profession with relevant knowledge and skills. The first year of this course includes a set of eight units that are common across all engineering honours courses. This allows students the opportunity to develop a better understanding of the various engineering disciplines on offer and the flexibility, if desired, to switch to another engineering discipline/course without penalty after the first year of study.","Electrical Engineer, Power Systems Engineer, Electrical Power Engineer",Australia,No,Yes,No,Yes,No,
HONS,Edith Cowan University,Perth,Bachelor of Engineering (Electronics and Communications) Honours,Engineering,"9,700","31,500",AUD,Years,4.0,Years,Yes,No,ATAR,IELTS,Equivalent ,82,6.0,Year 12,https://www.ecu.edu.au/degrees/courses/bachelor-of-engineering-electronics-and-communications-honours,English,A,"It provides graduates with skills in all aspects of analog and digital circuit design, as well as communication systems and communications networks development. The course concentrates on the engineering principles required to analyse and solve problems related to the design and implementation of electronic and communication systems. Graduates will be conversant in the fundamental engineering sciences, electronic circuits and systems, digital signal processing, radio communications, fibre optic and microwave communications, computer networking, and cellular and wireless networks. The program focuses on the development of knowledge and skills relevant to professional engineering practice and along with a sound theoretical base, includes strong elements of practical problem solving, team work and project development. As a result, as well as having multiple technical and transferable skill competencies, graduates will gain strong analytical skills, and have the ability to lead complex projects. The course provides a sound basis in mathematics, and in the fundamentals of electronics and engineering design principles in the first two years of study, along with relevant computer technology and programming principles. In the final two years of study, advanced topics from the electronics and communication systems engineering fields are covered to prepare students to enter their chosen profession with relevant knowledge and skills. The first year of this course includes a set of eight units that are common across all engineering honours courses. This allows students the opportunity to develop a better understanding of the various engineering disciplines on offer and the flexibility, if desired, to switch to another engineering discipline/course without penalty after the first year of study.","Electronics Engineer, Communications Engineer",Australia,No,Yes,No,Yes,No,
HONS,Edith Cowan University,Perth,Bachelor of Engineering (Instrumentation Control and Automation) Honours,Engineering,"9,700","31,500",AUD,Years,4.0,Years,Yes,No,ATAR,IELTS,Equivalent ,82,6.0,Year 12,https://www.ecu.edu.au/degrees/courses/bachelor-of-engineering-instrumentation-control-and-automation-honours,English,A,"This integrated discipline includes the development of intelligent systems to automate monitoring, processing, and production in different engineering industries. The course is designed to provide graduates with a strong background to enter into a range of career pathways related to automation and control application in the mining and mineral processing, oil and gas, and agriculture industries that are strongly represented in the economy of Western Australia. Graduates of the course will be conversant in electrical and electronic engineering; have specialist skills in design, development and management of advanced control and automation systems; and have the ability to participate in, and lead, complex multidisciplinary projects. The program focuses on the development of knowledge and skills relevant to professional engineering practice along with a sound theoretical base, and includes strong elements of practical problem solving, team work and project development. As a result, graduates will have strong analytical skills, in addition to multiple technical and transferable competencies. The course covers topics in process control algorithms, computer interfacing and communications of industrial controllers, as well as computer automation, including the use of PLCs, SCADA, and PC-based systems to control systems and processes. Topics such as advanced PLC control and SCADA systems, and manufacturing execution systems are introduced in the advanced years of the program, after students have gained proficiency in the theory of modern control and dynamic systems. The first year of this course includes a set of eight units that are common across all engineering honours courses. This allows students the opportunity to develop a better understanding of the various engineering disciplines on offer and the flexibility, if desired, to switch to another engineering discipline/course without penalty after the first year of study.","Control and Automation Engineer, Process Control Engineer, Instrumentation Engineer",Australia,No,Yes,No,Yes,No,
HONS,Edith Cowan University,Perth,Bachelor of Engineering (Marine and Offshore Engineering) Honours,Science,"9,700", ,AUD,Years,4.0,Years,Yes,Yes,ATAR,IELTS,Equivalent ,82,6.0,Year 12,https://www.ecu.edu.au/degrees/courses/bachelor-of-engineering-marine-and-offshore-engineering-honours,English,D,"Marine and offshore engineers are involved with the design, manufacture, deployment and commissioning of systems associated with the marine and offshore oil and gas industries. This course is suited to students interested in the large-scale mechanical and electro-mechanical systems used in the oil and gas industries, such as fuel-injected turbocharged engines, large gas turbine generators, or oil and gas rigs.","Oil and Gas Engineer, Naval Engineer, Process Engineer, Offshore Energy Engineer, Marine Surveyor, Mechanical Engineer, Maritime Engineer",Australia,No,Yes,No,Yes,No,
HONS,Edith Cowan University,Perth,Bachelor of Engineering (Mechanical) Honours,Engineering,"9,700","31,500",AUD,Years,4.0,Years,Yes,No,ATAR,IELTS,Equivalent ,82,6.0,Year 12,https://www.ecu.edu.au/degrees/courses/bachelor-of-engineering-mechanical-honours,English,A,"Areas of study within the course include a foundation in physical and engineering sciences, along with materials science and manufacturing, mechanical design, and building services. The course includes a particular focus on project based and practical learning and provides numerous opportunities for students to extend practical skills development. Students taking this course also have the option to undertake a specialist stream in motorsports. This option provides a special focus on automotive design and motorsports engineering. Students should consult the course coordinator if they are interested in pursuing this option. The program focuses on the development of knowledge and skills relevant to professional engineering practice and along with a sound theoretical base, includes strong elements of practical problem solving, team work and project development. As a result, as well as having multiple technical and transferable skill competencies, graduates will gain strong analytical skills, and have the ability to lead complex projects. The course provides a sound basis in mechanics, mathematics, and the principles of engineering design in the first two years of study, along with development of relevant knowledge in computer aided design and manufacturing, materials science, statics and dynamics, industrial maintenance, and mechanical design. In the final two years of study, a range of specialist mechanical engineering topics are covered, including electromechanical systems, structural analysis, advanced mechanical design, and building services, providing students with relevant knowledge and skills to enable them to contribute in the workforce as soon as they graduate. The first year of this course includes a set of eight units that are common across all engineering honours courses. This allows students the opportunity to develop a better understanding of the various engineering disciplines on offer and the flexibility, if desired, to switch to another engineering discipline/course without penalty after the first year of study.",Mechanical Engineer,Australia,No,Yes,No,Yes,No,
HONS,Edith Cowan University,Perth,Bachelor of Engineering (Mechatronics) Honours,Engineering,"9,700","31,500",AUD,Years,4.0,Years,Yes,No,ATAR,IELTS,Equivalent ,82,6.0,Year 12,https://www.ecu.edu.au/degrees/courses/bachelor-of-engineering-mechatronics-honours,English,A,"Whilst developing the strong analytical and problem-solving capabilities typical of any engineering program, this particular program is specifically tailored to Australia's resource-based and service industries. The course starts with a typical engineering science foundation in mathematics, mechanics, electrical engineering and computing, and then proceeds to cover major engineering topics, including digital electronics and microprocessor systems, advanced materials and manufacturing, and mechanical design. Mechatronics engineering gives a broader engineering coverage compared with standard mechanical or electrical engineering programs with the themes of automation, instrumentation, digital electronics, manufacturing, mechanical design, fluid mechanics and control systems. The program focuses on the development of knowledge and skills relevant to professional engineering practice and along with a sound theoretical base, includes strong elements of practical problem solving, team work and project development. As a result, as well as having multiple technical and transferable skill competencies, graduates will gain strong analytical skills, and have the ability to lead complex projects. Areas of study within the course include engineering mechanics, computer-aided design and manufacturing, analogue and digital electronics, signal analysis, electromechanical systems, industrial control, and robotics. The first year of this course includes a set of eight units that are common across all engineering honours courses. This allows students the opportunity to develop a better understanding of the various engineering disciplines on offer and the flexibility, if desired, to switch to another engineering discipline/course without penalty after the first year of study.","Mechatronics Engineer, Robotics Engineer, Automation Engineer",Australia,No,Yes,No,Yes,No,
HONS,Edith Cowan University,Perth,Bachelor of Engineering (Mechatronics) Honours Bachelor of Technology (Motorsports),Medical and Health Sciences,"9,700","31,500",AUD,Years,5.0,Years,Yes,No,ATAR,IELTS,Equivalent ,82,6.0,Year 12,https://www.ecu.edu.au/degrees/courses/bachelor-of-engineering-mechatronics-honours-bachelor-of-technology-motorsports,English,A,"Mechatronics engineering is the integration of electrical, electronic and computing engineering with mechanical engineering, enabling the development of intelligent machines and advanced manufacturing and processing systems. Areas of study within mechatronics include mechanics, computer-aided design and manufacturing, analogue and digital electronics, signal analysis, electro-mechanical systems, advanced materials, sensor technology, automatic control, robotics, system design and development, and project management. The course produces engineers with strong competencies in electrical, electronic, computer and mechanical engineering, who can participate in and lead complex, multidisciplinary projects. The motorsports component further develops engineering problem-solving abilities, as well as the technical, financial and management skills associated with manufacturing industries in general, and the motorsports industry in particular. Students gain a solid understanding of the entire design, simulation and fabrication processes and management issues associated with the manufacturing industries, with particular emphasis on motorsports. Students also have the opportunity to further develop competencies through the provision of extra-curricular activities to help progression into the motorsports industry. Applicants from South West WA will be able to study only the first year (up to eight foundation units) of this degree at ECU's Bunbury Campus, which may include attending a short set of lab sessions at Joondalup Campus by the end of each semester. After completing these eight units, Bunbury students will need to attend ECU's Joondalup Campus to complete the rest of their course. This option is only available for domestic students living in the South West region of WA.","Mechatronics Engineer, Mechanical Engineer, Automotive Engineer, Robotics Engineer, Automation Engineer",Australia,No,Yes,No,Yes,No,
HONS,Edith Cowan University,Perth,Bachelor of Engineering (Naval Architecture) Honours,Engineering,"9,700", ,AUD,Years,4.0,Years,Yes,Yes,ATAR,IELTS,Equivalent ,82,6.0,Year 12,https://www.ecu.edu.au/degrees/courses/bachelor-of-engineering-naval-architecture-honours,English,D,"Naval architects are professional engineers who design and oversee the construction and repair of marine craft and various offshore structures. This includes naval craft, passenger and cargo ships, submarines, high-speed ferries and catamarans, tugs, yachts and offshore drilling platforms. Naval architects understand the properties of the environments in which marine craft operate and determine ways to optimise their operations to meet operational, safety and performance goals.","Naval Architect, Maritime Engineer, Submersible Vehicle Engineer, Oil and Gas Engineer, Marine Surveyor, Mechanical Engineer",Australia,No,Yes,No,Yes,No,
HONS,Edith Cowan University,Perth,Bachelor of Engineering (Ocean Engineering) Honours,Engineering,"9,700", ,AUD,Years,4.0,Years,Yes,Yes,ATAR,IELTS,Equivalent ,82,6.0,Year 12,https://www.ecu.edu.au/degrees/courses/bachelor-of-engineering-ocean-engineering-honours,English,D,"Ocean engineers are involved in the design of some of the largest, most complex, and most expensive structures produced by humankind. These include offshore structures such as oil and gas platforms or subsea pipelines, as well as the wide range of infrastructure associated with the ports and harbour facilities and submersible vehicles required to service them.","Oil and Gas Engineer, Offshore Energy Engineer, Coastal Engineer, Submersible Vehicle Engineer, Structural Engineer, Maritime Engineer",Australia,No,Yes,No,Yes,No,
HONS,Edith Cowan University,Perth,Bachelor of Engineering (Petroleum Engineering) Honours,Engineering,"9,700","31,500",AUD,Years,4.0,Years,Yes,No,ATAR,IELTS,Equivalent ,82,6.0,Year 12,https://www.ecu.edu.au/degrees/courses/bachelor-of-engineering-petroleum-engineering-honours,English,A,"These fossil fuels are derived from oil and gas reservoirs in the earth's crust, but may also include extraction from sands and shales. This course provides the foundations for a professional engineering career in the oil and gas industry, both in Australia and internationally. As well as providing core mechanical and chemical engineering skills, the course provides specialist knowledge in drilling, reservoir and petroleum production engineering. The program focuses on the development of knowledge and skills relevant to professional engineering practice and along with a sound theoretical base, includes strong elements of practical problem solving, team work and project development. As a result, graduates will gain strong analytical skills, and have the ability to lead complex projects as well as having multiple technical and transferable skill competencies. The course provides a sound basis in mechanics, mathematics, and the principles of engineering design in the first two years of study, along with core areas of engineering science including chemistry and materials science, fluid mechanics, process systems and thermodynamics. In the final two years of study, a range of more specialist petroleum engineering topics are covered to prepare students to enter their chosen profession with relevant knowledge and skills. The first year of this course includes a set of eight units that are common across all engineering honours courses. This allows students the opportunity to develop a better understanding of the various engineering disciplines on offer and the flexibility, if desired, to switch to another engineering discipline/course without penalty after the first year of study.","Petroleum Engineer, Oil and Gas Engineer, Exploration Engineer, Reservoir Engineer, Drilling Engineer, Pipeline Engineer, Refining Engineer, Production Engineer",Australia,No,Yes,No,Yes,No,
HONS,Edith Cowan University,Perth,Bachelor of Engineering Honours Bachelor of Commerce,Engineering,"10,550","31,700",AUD,Years,5.0,Years,Yes,No,ATAR,IELTS,Equivalent ,82,6.0,Year 12,https://www.ecu.edu.au/degrees/courses/bachelor-of-engineering-honours-bachelor-of-commerce,English,A,"There is a growing demand in high-technology industries and research centres for engineers who also have knowledge and professional skills in business, management and finance.",,Australia,No,Yes,No,Yes,No,
HONS,Edith Cowan University,Perth,Bachelor of Engineering Honours Bachelor of Laws,Engineering,"13,400","39,400",AUD,Years,6.0,Years,Yes,No,ATAR,IELTS,Equivalent ,85,6.0,Year 12,https://www.ecu.edu.au/degrees/courses/bachelor-of-engineering-honours-bachelor-of-laws,English,A,"The result of this challenging educational initiative is an internationally recognised double degree that will create opportunities in the global marketplace. It provides students with lifelong transferable skills, equipping them for employment in a wide range of professions, and for further study in a variety of disciplines. ","Intellectual Property Lawyer, Technology Licensing Expert, Technology Law Enforcement Agent",Australia,No,Yes,No,Yes,No,
HONS,Edith Cowan University,Perth,Bachelor of Engineering Honours Bachelor of Science,Science,"9,700","32,650",AUD,Years,5.0,Years,Yes,No,ATAR,IELTS,Equivalent ,82,6.0,Year 12,https://www.ecu.edu.au/degrees/courses/bachelor-of-engineering-honours-bachelor-of-science,English,A,"There is a growing demand in high-technology industries and research centres for engineers with multidisciplinary skills in technology, management, and relevant sciences.This program broadens the overall knowledge of students in areas which are complementary to their technical skills. It offers a high level of flexibility as students are able to choose from a number of engineering and science specialist areas to select a combination that best suits their personal career aspirations.",,Australia,No,Yes,No,Yes,No,
BA,Edith Cowan University,Perth,Bachelor of Engineering Science,Science,"9,700","31,500",AUD,Years,3.0,Years,Yes,No,ATAR,IELTS,Equivalent ,92,6.0,Year 12,https://www.ecu.edu.au/degrees/courses/bachelor-of-engineering-science,English,A,"In the modern engineering environment, large-scale engineering projects are increasingly likely to be of a highly multi-disciplinary nature, requiring engineers from diverse backgrounds to be able to work effectively as a team to deliver the outcomes. In such environments, a broader understanding of engineering, beyond one specific area of specialisation, is highly desirable and advantageous. Developing such breadth in four-year engineering courses is a challenge as it compromises the level of specialist knowledge that is also required from a graduate engineer. Successful completion of this three-year program guarantees entry into ECU's Master of Engineering course, affording the opportunity to develop a chosen discipline specialisation building on this strong multi-disciplinary knowledge base.",,Australia,No,Yes,No,Yes,No,
BA,Edith Cowan University,Perth,Bachelor of Health Science,Science,"9,950","33,600",AUD,Years,3.0,Years,Yes,No,ATAR,IELTS,Equivalent ,70,6.0,Year 12,https://www.ecu.edu.au/degrees/courses/bachelor-of-health-science,English,A,"Health science is the study of the physical, psychological, social, and environmental dimensions of health. Students graduate with practical and theoretical knowledge and skills in communication, teamwork, critical thinking, innovation, and cross-cultural and international awareness. They are highly sought after and can select from a range of interesting and dynamic career pathways. Students can choose to undertake two eight-unit majors, or a major and minor, in these disciplines: Addiction Studies, Health Promotion, Nutrition, Occupational Safety and Health. Alternatively, students can undertake one 16-unit major in Nutrition Bioscience or Occupational and Environmental Health. A minor in Youth Work is also available.","Community Health Officer, Environmental Health Officer, Youth Worker, Child Health Officer, Health Promotion Officer, Health Worker, Nutritionist, Health Promotion Nutritionist, Occupational Safety and Health Management Officer, Occupational Hygiene Technician",Australia,Yes,Yes,Yes,Yes,No,
BA,Edith Cowan University,Bunbury,Bachelor of Health Science,Science,"9,950","33,600",AUD,Years,3.0,Years,Yes,No,ATAR,IELTS,Equivalent ,70,6.0,Year 12,https://www.ecu.edu.au/degrees/courses/bachelor-of-health-science,English,A,"Health science is the study of the physical, psychological, social, and environmental dimensions of health. Students graduate with practical and theoretical knowledge and skills in communication, teamwork, critical thinking, innovation, and cross-cultural and international awareness. They are highly sought after and can select from a range of interesting and dynamic career pathways. Students can choose to undertake two eight-unit majors, or a major and minor, in these disciplines: Addiction Studies, Health Promotion, Nutrition, Occupational Safety and Health. Alternatively, students can undertake one 16-unit major in Nutrition Bioscience or Occupational and Environmental Health. A minor in Youth Work is also available.","Community Health Officer, Environmental Health Officer, Youth Worker, Child Health Officer, Health Promotion Officer, Health Worker, Nutritionist, Health Promotion Nutritionist, Occupational Safety and Health Management Officer, Occupational Hygiene Technician",Australia,Yes,Yes,Yes,Yes,No,
BA,Edith Cowan University,Perth,Bachelor of Hospitality and Tourism Management,Business and Law,"11,400","31,850",AUD,Years,3.0,Years,Yes,Yes,ATAR,IELTS,Equivalent ,70,6.0,Year 12,https://www.ecu.edu.au/degrees/courses/bachelor-of-hospitality-and-tourism-management,English,A,"It also features specialised units in food and beverage management, rooms division management, tourism planning and development, ecotourism, managing the service experience and event management. Students can further specialise their studies with a stronger focus in various fields, such as event management, marketing, human resource management, and international business. The hospitality and tourism industry is dynamic and fast-paced, presenting graduates with a wide variety of career options to choose from, and the course provides students the industry-focused theoretical knowledge and skills to succeed. Graduates will gain the essential competencies and professional perspectives required by middle and senior levels of management in contemporary hospitality and tourism organisations.","Hotel Manager, Resort Manager, Food and Beverage Manager, Front Office Manager, Hotel Sales Manager, Tour Operator, Visitor Centre Manager, Theme Park Manager, Cruise Ship Supervisor, Eco-tourism Operator",Australia,Yes,Yes,Yes,Yes,Yes,
