Level_Code,University,City,Course,Faculty,Int_Fees,Local_Fees,Currency,Currency_Time,Duration,Duration_Time,Full_Time,Part_Time,Prerequisite_1,Prerequisite_2,Prerequisite_3,Prerequisite_1_grade_1,Prerequisite_2_grade_2,Prerequisite_3_grade_3,Website,Course_Lang,Availability,Description,Career_Outcomes/path,Country,Online,Offline,Distance,Face_to_Face,Blended,Remarks,Subject_or_Unit_1,Subject_Objective_1,Subject_Description_1,Subject_or_Unit_2,Subject_Objective_2,Subject_Description_2,Subject_or_Unit_3,Subject_Objective_3,Subject_Description_3,Subject_or_Unit_4,Subject_Objective_4,Subject_Description_4,Subject_or_Unit_5,Subject_Objective_5,Subject_Description_5,Subject_or_Unit_6,Subject_Objective_6,Subject_Description_6,Subject_or_Unit_7,Subject_Objective_7,Subject_Description_7,Subject_or_Unit_8,Subject_Objective_8,Subject_Description_8,Subject_or_Unit_9,Subject_Objective_9,Subject_Description_9,Subject_or_Unit_10,Subject_Objective_10,Subject_Description_10,Subject_or_Unit_11,Subject_Objective_11,Subject_Description_11,Subject_or_Unit_12,Subject_Objective_12,Subject_Description_12,Subject_or_Unit_13,Subject_Objective_13,Subject_Description_13,Subject_or_Unit_14,Subject_Objective_14,Subject_Description_14,Subject_or_Unit_15,Subject_Objective_15,Subject_Description_15,Subject_or_Unit_16,Subject_Objective_16,Subject_Description_16,Subject_or_Unit_17,Subject_Objective_17,Subject_Description_17,Subject_or_Unit_18,Subject_Objective_18,Subject_Description_18,Subject_or_Unit_19,Subject_Objective_19,Subject_Description_19,Subject_or_Unit_20,Subject_Objective_20,Subject_Description_20,Subject_or_Unit_21,Subject_Objective_21,Subject_Description_21,Subject_or_Unit_22,Subject_Objective_22,Subject_Description_22,Subject_or_Unit_23,Subject_Objective_23,Subject_Description_23,Subject_or_Unit_24,Subject_Objective_24,Subject_Description_24,Subject_or_Unit_25,Subject_Objective_25,Subject_Description_25,Subject_or_Unit_26,Subject_Objective_26,Subject_Description_26,Subject_or_Unit_27,Subject_Objective_27,Subject_Description_27,Subject_or_Unit_28,Subject_Objective_28,Subject_Description_28,Subject_or_Unit_29,Subject_Objective_29,Subject_Description_29,Subject_or_Unit_30,Subject_Objective_30,Subject_Description_30,Subject_or_Unit_31,Subject_Objective_31,Subject_Description_31,Subject_or_Unit_32,Subject_Objective_32,Subject_Description_32,Subject_or_Unit_33,Subject_Objective_33,Subject_Description_33,Subject_or_Unit_34,Subject_Objective_34,Subject_Description_34,Subject_or_Unit_35,Subject_Objective_35,Subject_Description_35,Subject_or_Unit_36,Subject_Objective_36,Subject_Description_36,Subject_or_Unit_37,Subject_Objective_37,Subject_Description_37,Subject_or_Unit_38,Subject_Objective_38,Subject_Description_38,Subject_or_Unit_39,Subject_Objective_39,Subject_Description_39,Subject_or_Unit_40,Subject_Objective_40,Subject_Description_40
GCERT,University of Newcastle,Newcastle,Graduate Certificate in Applied Finance,Health & Medicine,"20,225",,AUD,Years,6.0,Months,Yes,Yes,,IELTS,,,6.5,,https://www.newcastle.edu.au/degrees/graduate-certificate-applied-finance,English,A,"Pursuing a career in finance can be challenging, yet rewarding, as it can open up a range of career opportunities and enable you to become a leader in the global business environment. A Graduate Certificate in Applied Finance at the University of Newcastle will equip you with a highly regarded qualification that provides superior fundamental finance knowledge, including high-level analytical skills that are transferable across the finance sector, and can be used to inform decision-making across other areas of business. The University of Newcastle provides flexible study options. Courses are run in trimesters and students are provided with an opportunity to study at a pace which suits their personal and professional lives.","Business Analyst, Business Relationship Manager, Finance Manager, Financial Analyst, Financial Planner, Investment Banker, Management Consultant, Portfolio Analyst, Stockbroker",Australia,No,Yes,No,Yes,No,,GSBS6002 Foundations of Business Analysis,"Intelligent business decisions rely upon timely and accurate analysis of information. This course introduces students to the concepts, knowledge and techniques required to identify business needs and solve business problems. Within the course, students develop the ability to collect data from stakeholders, and convert this data into actionable information that can assist in business decision-making. The skills developed throughout this course can be applied to new insights and understanding across all functional areas of business.",Available,GSBS6130 Corporate Finance,"The course provides an introduction to corporate financial theory and application of theory to problems relevant to managers and is designed as a core course in the Master of Applied Finance. Topics covered will include: specification of corporate objectives, evaluation of investment projects, alternative sources of finance, risk, the operation of capital markets, the financing decision, the dividend decision, and the cost of capital.",Available,GSBS6200 Financial and Management Accounting,This course introduces financial and management accounting to non-accountants. It aims to provide an understanding of the main accounting concepts and the practical use of accounting and financial information for decision making and the achievement of business goals.,Available,,,,,,,,,,,,,,,,,,,,,,,,,,,,,,,,,,,,,,,,,,,,,,,,,,,,,,,,,,,,,,,,,,,,,,,,,,,,,,,,,,,,,,,,,,,,,,,,,,,,,,,,,,,,,,,
GCERT,University of Newcastle,Sydney,Graduate Certificate in Professional Accounting,Health & Medicine,"16,470",,AUD,Years,6.0,Months,Yes,Yes,,IELTS,,,6.5,,https://www.newcastle.edu.au/degrees/graduate-certificate-professional-accounting,English,A,"A career in accounting provides challenging, rewarding and versatile opportunities in the current business environment. Increasingly businesses are looking for people with superior analytical skills which accounting can provide. The Graduate Certificate of Professional Accounting program is designed for students with a degree in a field other than accounting who wish to obtain an introduction to accounting concepts and procedures.","Financial and management accounting, Taxation, Auditing, Superannuation, Investment, Financial advising, Banking, Stockbroking",Australia,No,Yes,No,Yes,No,,PACC6000 Financial Accounting 1,"Fundamental principles underpin accrual accounting and financial reporting. Financial Accounting 1 critically examines these principles providing students with the technical skills of accounting, including the analysis, recording, preparation and interpretation of accounting information.",Available,PACC6001 Management Accounting,"Within organisations accounting practice and data directly influence everyday management decision making. The course introduces students to the concept of cost, cost behaviour, product costing systems, cost allocation and activity-based costing, budgeting, and  standard costing control systems, relevant costing, pricing decisions and customer profitability analysis. Professional communication within management settings and contexts will be emphasised as an important attribute.",Available,PACC6003 Business Finance,"The course provides an introduction to corporate finance theories and how these theories can be applied to problems relevant to managers. Topics covered will include: corporate objectives, operations of capital markets, alternative sources of finance, dividend decision, financing decision, cost of capital, time value of money, evaluation of investment projects, and risk and return.",Available,PACC6007 Economics,"Economics addresses problems and issues at every level of business, government and community. This course investigates both microeconomic and macroeconomic principles. The microeconomic component explores supply and demand; elasticity; the operation of markets; costs and production; perfect competition & monopoly; monopolistic competition & oligopoly; wages, the distribution of income & inequality; market failure and government policy. The analysis of macroeconomics includes the determination of economic activity, money and the financial system; inflation and unemployment; the balance of payments and exchange rates; and macroeconomic policy.",Available,,,,,,,,,,,,,,,,,,,,,,,,,,,,,,,,,,,,,,,,,,,,,,,,,,,,,,,,,,,,,,,,,,,,,,,,,,,,,,,,,,,,,,,,,,,,,,,,,,,,,,,,,,,,
MST,University of Newcastle,Newcastle,Master of Applied Finance,Health & Medicine,"40,175",,AUD,Years,18.0,Months,Yes,Yes,,IELTS,,,6.5,,https://www.newcastle.edu.au/degrees/master-applied-finance,English,A,"The Master of Applied Finance program at the University of Newcastle is focused on developing high-level analytical skills that are relevant across the finance sector, and can also be used to inform decision making across other areas of business. The Master of Applied Finance program will arm you with the technical knowledge and practical skills required to succeed in finance.","Finance Manager, Financial Analyst, Investment Banker, Management Consultant, Portfolio Analyst",Australia,No,Yes,No,Yes,No,,GSBS6002 Foundations of Business Analysis,"Intelligent business decisions rely upon timely and accurate analysis of information. This course introduces students to the concepts, knowledge and techniques required to identify business needs and solve business problems. Within the course, students develop the ability to collect data from stakeholders, and convert this data into actionable information that can assist in business decision-making. The skills developed throughout this course can be applied to new insights and understanding across all functional areas of business.",Available,GSBS6130 Corporate Finance,"The course provides an introduction to corporate financial theory and application of theory to problems relevant to managers and is designed as a core course in the Master of Applied Finance. Topics covered will include: specification of corporate objectives, evaluation of investment projects, alternative sources of finance, risk, the operation of capital markets, the financing decision, the dividend decision, and the cost of capital.",Available,GSBS6140 Investment Analysis,"This course provides students with a solid foundation in theories and methods of pricing securities. It provides an overview of the operation of the securities markets and the mechanics of trading securities. The fundamental valuation tools, including models of risk and return, discounted cash flows and relative valuation are examined and applied to the pricing of securities.",Available,GSBS6142 Derivatives and Risk Management,"A broad range of derivative products are examined with a primary focus on how to use these for the management of financial risks. The course introduces standard models of pricing forward, futures and options on diverse underlying assets. The course then explores hedging methods to conduct risk management for business operations, speculative trades, and issued financial instruments. After completing this course students will be familiar with derivatives valuation and their use in risk management.",Available,GSBS6143 Applied Portfolio Management,"Applied Portfolio Management deals with the construction and management of an institutional investment portfolio. It provides students with a thorough understanding of procedures involved in portfolio management - setting portfolio objectives, determining investment policy, formulating investment strategies, devising rules for updating portfolio, evaluation performance and protecting portfolio. Students will be provided with various management investment products and fund management practices in Australia.",Available,GSBS6144 Financial Institutions Management,"This course provides an insight into measuring and managing risk exposures of firms operating in the financial services industry. Introducing analytical tools of measuring interest rate risk, credit risk, and liquidity risk.",Available,GSBS6145 International Financial Management,"The course undertakes an in-depth examination of international financial markets and instruments, foreign exchange regimes and exchange rate determination. A significant part of this course also covers alternative methods of financing international operations and strategies for foreign direct investment and alternative methods.",Available,GSBS6200 Financial and Management Accounting,This course introduces financial and management accounting to non-accountants. It aims to provide an understanding of the main accounting concepts and the practical use of accounting and financial information for decision making and the achievement of business goals.,Available,GSBS6506 Financial Statement Analysis,"This course introduces key valuation theories for fundamental analysis. The primary emphasis is on equity valuation, with a focus on developing and applying methods for valuing firms using financial statement analysis. Topics include the residual earnings model and the abnormal earnings growth model.",Available,,,,,,,,,,,,,,,,,,,,,,,,,,,,,,,,,,,,,,,,,,,,,,,,,,,,,,,,,,,,,,,,,,,,,,,,,,,,,,,,,,,,,,,,,,,,,
MST,University of Newcastle,Newcastle,Master of Architecture,Health & Medicine,"35,655",,AUD,Years,2.0,Years,Yes,Yes,,IELTS,,,6.5,,https://www.newcastle.edu.au/degrees/master-architecture,English,A,"Quietly change the world. Architecture at the University of Newcastle is different. We believe in the third space. We look for grey where there is only black and white. We’re about people. We use architecture and bold ideas to create social change. The City of Newcastle is on the cusp of total transformation, making it a unique centre for innovative design practice. Our students work on live projects that solve real design problems, working side-by-side with communities on an international scale. These projects culminate in spectacular public exhibitions, giving students the opportunity to showcase their work to industry and the local community. The University of Newcastle's architecture design studio is also like no other. An incredibly close-knit and supportive community, students have their own personal-work-station. It’s where inspiration and creativity thrives.","private and commercial practice, research, construction, project management, property development, town planning, infrastructure planning, overseas aid, State Boards of Architects, Architects Accreditation Council of Australia (AACA), Australian Institute of Architects, Royal Institute of British Architects, Board of Architects Malaysia (LAM)",Australia,No,Yes,No,Yes,No,,ARBE6201 Architectural Management,"Deals with the project management context within which architecture is practiced.  Students will consider the development of professional expertise, and be introduced to the methods used to generate work and charge fees. The course will also address the project briefing and contract administration phases of an architectural project, including the development of a design brief and project feasibility analysis, development and contract law, project management frameworks, consultancy agreements, and the administration of a standard form lump sum building contract.",Available,ARBE6202 Architectural Practice,"Deals with the business and professional context within which architecture is practiced. Students will be introduced to the principles of business management including business ethics, organisational theory and behaviour as they relate to architectural practice, and the variety of opportunities and uncertainties faced by the practicing architect. The course will also address the structure of the architectural profession, employment opportunities, business planning for an architectural practice, and management of the design process in an architectural office.",Available,ARBE6231 Architecture Studio 7,This course requires students to apply architectural knowledge and skills related to the design of compact and resilient urban environments within cities.,Available,ARBE6232 Architecture Studio 8,"The architecture as research studio is structured into a number of tutor-led themes aligned to complex issues associated with the built environment. Students devise a research model that includes data gathering, recursive experimentation, weekly discussion and critique leading to an architectural proposition. Research findings are presented through a process of continuous engagement with a self-directed individual case study problem.",Available,ARBE6233 Architecture Studio 9,"This course enables students to undertake a final design research thesis, by approaching architectural practice as an exploratory, creative enquiry. Students develop a design project that enables a chosen research agenda. This involves establishing project limits and constraints, experimenting though chosen design methods, media & representational strategies, demonstrating an awareness of ethics, and exercising critical refection. By the end of semester, students will present a resolved project that consolidates and explicates a process of design enquiry, with a booklet that articulates and reflects upon the semester’s process.",Available,ARBE6234 Architecture Studio 10,"This course prepares students for the practice of architecture. Through the consideration of architectural practice as a research based enquiry, a self-directed architectural project is prepared and communicated as a developed design, and then documented technically as detailed architecture.",Available,,,,,,,,,,,,,,,,,,,,,,,,,,,,,,,,,,,,,,,,,,,,,,,,,,,,,,,,,,,,,,,,,,,,,,,,,,,,,,,,,,,,,,,,,,,,,,,,,,,,,,
MST,University of Newcastle,Sydney,Master of Professional Accounting,Health & Medicine,"33,575",,AUD,Years,18.0,Months,Yes,Yes,,IELTS,,,6.5,,https://www.newcastle.edu.au/degrees/master-professional-accounting,English,A,"A career in accounting provides challenging, rewarding and versatile opportunities in the current business environment. Increasingly, businesses are looking for people with superior analytical skills that accounting can provide. A Master of Professional Accounting is a qualification that equips graduates with the knowledge and skills to succeed in accounting and aid career progression to senior management level.","Forensic Accountant, Internal Auditor, Ratings Analyst, Chief Financial Officer, Financial Advisor",Australia,No,Yes,No,Yes,No,,PACC6000 Financial Accounting 1,"Fundamental principles underpin accrual accounting and financial reporting. Financial Accounting 1 critically examines these principles providing students with the technical skills of accounting, including the analysis, recording, preparation and interpretation of accounting information.",Available,PACC6001 Management Accounting,"Within organisations accounting practice and data directly influence everyday management decision making. The course introduces students to the concept of cost, cost behaviour, product costing systems, cost allocation and activity-based costing, budgeting, and  standard costing control systems, relevant costing, pricing decisions and customer profitability analysis. Professional communication within management settings and contexts will be emphasised as an important attribute.",Available,PACC6002 Auditing and Assurance Services,The course introduces students to the major conceptual and technical aspects of auditing. Emphasis is placed on financial statement audits conducted under the Corporations Law. The course also provides insight into other types of audit and assurance activities and emphasises the risk-based approach to auditing.,Available,PACC6003 Business Finance,"The course provides an introduction to corporate finance theories and how these theories can be applied to problems relevant to managers. Topics covered will include: corporate objectives, operations of capital markets, alternative sources of finance, dividend decision, financing decision, cost of capital, time value of money, evaluation of investment projects, and risk and return.",Available,PACC6004 Financial Accounting 2,"The course examines general purpose financial reporting from the perspective of a single incorporated entity. In doing so, the course emphasises the development of the knowledge, understanding and skills needed to interpret and apply accounting standards and procedures to solve accounting problems which companies encounter in practice.",Available,PACC6005 Financial Accounting 3,"This courses focuses on company accounting. It provides students with an understanding of the regulatory framework for corporate financial reporting in Australia, and provides detailed coverage of the requirements for the preparation of financial statements for a group of companies operating under common control. Topics covered include accounting for corporate acquisitions; consolidation accounting; consolidated cash flow statements; accounting for company income tax; and accounting for foreign operations and corporate insolvency.",Available,PACC6006 Taxation Law,"Taxation in Australia originates from a complex legal and constitutional foundation. This course analyses both the legal concepts of income and capital and the fiscal treatment of individual, corporate, and other taxpaying entities. Specific topics covered include GST, assessable income and exempt income, allowable deductions, special classes of taxpayers including trusts, partnerships and companies, calculation of individual income tax, capital gains tax, fringe benefits tax, depreciable assets, residency and retirement and termination payments. Course experience will assist students to define and articulate taxation issues as well as professionally communicate recommended solutions.",Available,PACC6007 Economics,"Economics addresses problems and issues at every level of business, government and community. This course investigates both microeconomic and macroeconomic principles. The microeconomic component explores supply and demand; elasticity; the operation of markets; costs and production; perfect competition & monopoly; monopolistic competition & oligopoly; wages, the distribution of income & inequality; market failure and government policy. The analysis of macroeconomics includes the determination of economic activity, money and the financial system; inflation and unemployment; the balance of payments and exchange rates; and macroeconomic policy.",Available,PACC6008 Business Decision Making,"Quantitative techniques are frequently employed as essential research and analytical tools in accounting, financial and economic environments. This course provides an understanding of the quantitative techniques that are frequently used in accounting, financial and economic studies to aid business decision making. Statistical techniques such as data screening and descriptive techniques, inferential statistics, sampling, questionnaire and research design, hypothesis testing, analysis of variance and regression analysis are covered. Use is made of Microsoft Excel statistical package to analyse data sets and produce reports based on quantitative analyses. Participants will build increased competency in business communication skills and techniques.",Available,PACC6009 Business Law,"Business Law provides the necessary legal framework to inform professional practice within accounting and related professions. This course encompasses both contract and commercial law introducing the participants to the Australian legal system, including sources of law, legal institutions and torts law. Topics developed under contract law include the law of offer and acceptance, consideration, breach of contract, remedies for breach of contract, and contract law with respect to the sale of goods. Commercial law topics comprise consumer law, the Competition and Consumer Act, principal and agent, property, trusts, consumer credit and law with respect to bankruptcy.",Available,PACC6010 Company Law,"A company possesses its own legal identity. This course provides an in depth analysis of the classifications and features of companies, the obligations and rights of parties to the corporation with emphasis on the main legislation. Directions for focus include consideration of the company as a legal person; the incorporation of companies; internal governance; director's duties and shareholder's rights; accounts and financial disclosure; transacting and external administration. As alternatives to the corporate form the course sources and interprets the different legal forms of sole trader, partnership and trading trusts. Students will experience increased confidence in employing legal terminology, tools and communication in diverse situations.",Available,PACC6011 Accounting Information Systems,"Examines the theory and practice of Accounting Information Systems. Covers all aspects of the use of information technology to support the contemporary organisation, with particular emphasis on support for Accounting and Finance. Industry-focused case studies and detailed practical exercises are used to underpin the conceptual models used to describe the elements of modern accounting support systems.",Available,,,,,,,,,,,,,,,,,,,,,,,,,,,,,,,,,,,,,,,,,,,,,,,,,,,,,,,,,,,,,,,,,,,,,,,,,,,,,,,,,,,,
