CERTIII,Kangan Batman Institute,Online,Certificate III in Agricultural Mechanical Technology,Heavy Commercial Vehicles & Engine Techn,3449,685,17987,3449,685,17987,AUD,Years,3.0,Years,Yes,Yes,ATAR,IELTS,,,,,https://www.kangan.edu.au/tafe-courses/certificate-iii-in-agricultural-mechanical-technology-3144,English,,"You will be advised by your facilitator on a case by case basis in relation to practical and work placement assessments, as some flexibility will be required during this challenging time.This course trains you for work with heavy vehicle agricultural equipment. You will gain the skills and knowledge to competently carry out service, repair and diagnostic procedures. You will learn how to apply safe work practices, carry out servicing operations and develop knowledge of diagnostic procedures.Click here for course modulesHow will I be assessed?You will be assessed to show that you have achieved the skills and knowledge required by the course. Assessment may include written, oral or practical assessment methods. You will be advised in advance about the type of assessment and the how it will operate. There is the opportunity for reassessment and appeal and you will be provided with this information.",This course is intended to prepare you to perform mechanical work in the agricultural vehicle and equipment service and repair sector. This course may lead to employment as an Agricultural Mechanical Technician.,Australia,Yes,Yes,Yes,Yes,Yes,,,No,AURACA001 Respond to customer needs and enquiries in an automotive workplace ,Nominal Hours = 20,,AURAEA002 Follow environmental and sustainability best practice in an automotive workplace ,Nominal Hours = 25,,AURAFA003 Communicate effectively in an automotive workplace ,Nominal Hours = 20,,AURASA002 Follow safe working practices in an automotive workplace ,Nominal Hours = 20,,AURETR012 Test and repair basic electrical circuits ,Nominal Hours = 40,,"AURETR025 Test, charge and replace batteries and jump-start vehicles ",Nominal Hours = 15,,AURETR029 Diagnose and repair charging systems ,Nominal Hours = 30,,AURETR030 Diagnose and repair starting systems ,Nominal Hours = 30,,AURHTE002 Diagnose and repair heavy vehicle compression ignition engines ,Nominal Hours = 70,,AURHTF002 Diagnose and repair heavy vehicle diesel fuel injection systems ,Nominal Hours = 80,,AURHTQ003 Diagnose and repair heavy vehicle drive shafts ,Nominal Hours = 30,,AURKTA011 Diagnose and repair mobile plant hydraulic systems ,Nominal Hours = 60,,AURKTB001 Diagnose and repair mobile plant braking systems ,Nominal Hours = 40,,AURKTD002 Diagnose and repair mobile plant steering systems ,Nominal Hours = 40,,AURKTQ001 Diagnose and repair mobile plant final drive assemblies ,Nominal Hours = 30,,AURKTX001 Diagnose and repair powershift transmissions ,Nominal Hours = 50,,AURTTA004 Carry out servicing operations ,Nominal Hours = 20,,"AURTTA005 Select and use bearings, seals, gaskets, sealants and adhesives ",Nominal Hours = 10,,AURTTA018 Carry out diagnostic procedures ,Nominal Hours = 20,,AURTTB001 Inspect and service braking systems ,Nominal Hours = 20,,AURTTC003 Diagnose and repair cooling systems ,Nominal Hours = 20,,AURTTE004 Inspect and service engines ,Nominal Hours = 20,,AURTTK002 Use and maintain tools and equipment in an automotive workplace ,Nominal Hours = 20,,AURAEA003 Monitor environmental and sustainability best practice in an automotive workplace ,Nominal Hours = 25,,AURETR024 Diagnose and repair compression ignition engine management systems ,Nominal Hours = 50,,AURETU003 Service air conditioning and HVAC systems ,Nominal Hours = 25,,AURETU004 Diagnose and repair air conditioning and HVAC systems ,Nominal Hours = 35,,AURETU005 Retrofit and modify air conditioning and HVAC systems ,Nominal Hours = 30,,AURHTD002 Diagnose and repair heavy commercial vehicle steering systems ,Nominal Hours = 40,,AURHTE001 Remove and install heavy vehicle engine assemblies ,Nominal Hours = 35,,AURHTQ002 Diagnose and repair heavy commercial vehicle final drive assemblies ,Nominal Hours = 30,,AURHTX001 Diagnose and repair heavy vehicle manual transmissions ,Nominal Hours = 50,,AURHTX003 Diagnose and repair heavy vehicle automatic transmissions ,Nominal Hours = 60,,AURHTX004 Diagnose and repair heavy vehicle clutch systems ,Nominal Hours = 35,,"AURKTA002 Inspect, service and repair crop harvesting equipment ",Nominal Hours = 40,,"AURKTA003 Inspect, service and repair crop planting and seeding equipment ",Nominal Hours = 40,,"AURKTA004 Inspect, service and repair spraying and spreading equipment ",Nominal Hours = 40,,"AURKTA005 Inspect, service and repair track type drive and support systems ",Nominal Hours = 30,,AURMBA002 Load and unload competition vehicles and support equipment ,Nominal Hours = 20,,AURTTA006 Inspect and service hydraulic systems ,Nominal Hours = 20,
CERTIII,Kangan Batman Institute,Melbourne,Certificate III In Agriculture,Food & Fibre,4000,800,10112,,,,AUD,Years,6.0,Months,Yes,Yes,ATAR,IELTS,,,,,https://www.kangan.edu.au/tafe-courses/certificate-iii-in-agriculture-3345,English,,"You will be advised by your facilitator on a case by case basis in relation to practical and work placement assessments, as some flexibility will be required during this challenging time.This course is tailored for those who are interested in growing food whilst managing the natural environment.You will learn about the importance of managing the soil and revegetation programs, including an introduction to beneficial indigenous species and to the technology required to manage the challenges of climate change; with weekly weather monitoring and water analysis, mapping for weed control and revegetation programs as well as understanding the importance of complying with animal welfare requirements.Free TAFE and JobTrainerYou may be entitled to free tuition fees for this course if you meet the eligibility criteria for the State Government’s FREE TAFE for Priority Courses initiative. If you are aged 17-24 or looking for work, you may be eligible to study this course low-fee through JobTrainer. It's important to know that you may incur other fees, such as student services fees or materials fees, and you'll need to cover these costs yourself. To find out more, call 13 TAFE (13 8233) or contact us via our online enquiry form.Click here for course modulesHow will I be assessed?You will be assessed to show that you have achieved the skills and knowledge required by the course. Assessment may include written, oral or practical assessment methods. You will know in advance about the type of assessment and how it will operate. There is the opportunity for reassessment and appeal and you will be given this information.What will I study?Please see list of core modules above.",Job roles vary across different industry sectors and may include: Farm or station hand Farm or station worker Livestock transport driver,Australia,No,Yes,No,Yes,No,,,Yes,AHCWHS301 Contribute to work health and safety processes ,Nominal Hours = 50,,AHCWRK309 Apply environmentally sustainable work practices ,Nominal Hours = 50,,AHCBEK204 Construct and repair beehives ,Nominal Hours = 25,,AHCBEK306 Manage pests and disease within a honey bee colony ,Nominal Hours = 60,,AHCCHM303 Prepare and apply chemicals ,Nominal Hours = 70,,AHCCHM304 Transport and store chemicals ,Nominal Hours = 50,,AHCINF303 Plan and construct conventional fencing ,Nominal Hours = 60,,AHCIRG217 Assist with pressurised irrigation operations ,Nominal Hours = 40,,AHCLPW306 Undertake sampling and testing of water ,Nominal Hours = 70,,AHCMOM213 Operate and maintain chainsaws ,Nominal Hours = 40,,AHCMOM304 Operate machinery and equipment ,Nominal Hours = 40,,AHCPCM301 Implement a plant nutrition program ,Nominal Hours = 60,,AHCPCM302 Provide information on plants and their culture ,Nominal Hours = 70,,AHCPMG301 Control weeds ,Nominal Hours = 70,,"AHCPMG302 Control plant pests, diseases and disorders ",Nominal Hours = 80,,AHCSOL401 Sample soils and interpret results ,Nominal Hours = 60,,AHCWOL310 Press wool for a clip ,Nominal Hours = 25,,AHCWOL311 Perform shed duties ,Nominal Hours = 120,,AHCWRK302 Monitor weather conditions ,Nominal Hours = 60,,FDFWGG3006A Coordinate hand pruning activities ,Nominal Hours = 40,,,,,,,,,,,,,,,,,,,,,,,,,,,,,,,,,,,,,,,,,,,,,,,,,,,,,,,,,,,,,
CERTIII,Kangan Batman Institute,Melbourne,Certificate III In Animal Studies,Food & Fibre,1808,362,7384,,,,AUD,Years,1.0,Year,Yes,No,ATAR,IELTS,,,,,https://www.kangan.edu.au/tafe-courses/certificate-iii-in-animal-studies-3325,English,,"Practical Placement is a mandatory component of this course. Kangan Institute will make efforts to secure  an appropriate placement. Due to the current environment and circumstances outside our control placements may be delayed. This may then impact the completion dates for this course and deferment of graduation.  Before you can start your practical placement, you will need to provide the following compulsory requirements:• A valid Working with Children Check (Volunteer)• A satisfactory National Police Check – National Police checks are conducted via fit2work. An account with fit2work will be created using the student’s name and the Kangan Institute issued student email address, once studies in the program have commenced. Further information will be provided once enrolment has been completed.Love caring for your pets and thinking of pursuing a career in this area? This course can lead to working with a range of animals providing basic care, maintenance and monitoring the health care and wellbeing of animals.It is highly recommended that whilst undertaking this qualification, you should have access to a companion animal workplace through either paid employment or substantial periods of 80 hours work placement.Watch our Recorded Information Session to learn more about this course including career opportunities, work placements, fees and more - Watch HereClick here for course modulesHow will I be assessed?You will be assessed to show that you have achieved the skills and knowledge required by the course. Assessment may include written, oral or practical assessment methods. You will know in advance about the type of assessment and how it will operate. There is the opportunity for reassessment and appeal and you will be given this information. Will include work placement.",This course may lead to employment in the animal care industry. Animal care receptionist and support officer Animal control and regulation assistant Animal health officer on indigenous communities Animal shelter assistant Assistant animal welfare officer,Australia,No,Yes,No,Yes,No,,,No,ACMGAS202 Participate in workplace communications ,Nominal Hours = 20,,ACMGAS203 Complete animal care hygiene routines ,Nominal Hours = 30,,ACMGAS301 Maintain and monitor animal health and wellbeing ,Nominal Hours = 50,,ACMGAS303 Plan for and provide nutritional requirements for animals ,Nominal Hours = 60,,ACMINF301 Comply with infection control policies and procedures in animal care work ,Nominal Hours = 60,,ACMSUS201 Participate in environmentally sustainable work practices ,Nominal Hours = 20,,ACMWHS301 Contribute to workplace health and safety processes ,Nominal Hours = 50,,ACMCAN311 Care for young animals ,Nominal Hours = 40,,ACMCAS307 Provide companion animal hydro-bathing services ,Nominal Hours = 40,,ACMGAS302 Provide enrichment for animals ,Nominal Hours = 40,,ACMSPE304 Provide basic care of domestic dogs ,Nominal Hours = 40,,ACMSPE305 Provide basic care of domestic cats ,Nominal Hours = 40,,ACMSPE310 Provide basic care of mammals ,Nominal Hours = 40,,ACMSPE311 Provide basic care of non-venomous reptiles ,Nominal Hours = 40,,AHCFAU201 Recognise fauna ,Nominal Hours = 40,,AHCPMG307 Apply animal trapping techniques ,Nominal Hours = 40,,,,,,,,,,,,,,,,,,,,,,,,,,,,,,,,,,,,,,,,,,,,,,,,,,,,,,,,,,,,,,,,,,,,,,,,,
CERTIII,Kangan Batman Institute,Melbourne,Certificate III in Automotive Body Repair Technology,Heavy Commercial Vehicles & Engine Techn,3384,672,16911,,,,AUD,Years,3.0,Years,Yes,Yes,ATAR,IELTS,,,,,https://www.kangan.edu.au/tafe-courses/certificate-iii-in-automotive-body-repair-technology-3152,English,,"You will be advised by your facilitator on a case by case basis in relation to practical and work placement assessments, as some flexibility will be required during this challenging time.The Certificate III in Automotive Body Repair Technology (AUR32116) covers skills and knowledge required to repair and maintain the body of cars, heavy vehicles and other vehicles in the automotive industry.This automotive apprenticeship course provides comprehensive knowledge and skills in the vehicle body fields of panel beating.Click here for course modulesHow will I be assessed?You will be assessed to show that you have achieved the skills and knowledge required by the course. Assessment may include written, oral or practical assessment methods. You will be advised in advance about the type of assessment and the how it will operate. There is the opportunity for reassessment and appeal and you will be provided with this information.","The Certificate III in Automotive Body Repair Technology (AUR32116) prepares you to repair, maintain and remanufacture the body of vehicles in the automotive industry. This course may lead to employment as a:",Australia,Yes,Yes,Yes,Yes,Yes,,,No,AURAEA002 Follow environmental and sustainability best practice in an automotive workplace ,Nominal Hours = 25,,AURAFA008 Interpret and apply automotive repair instructions ,Nominal Hours = 20,,AURASA002 Follow safe working practices in an automotive workplace ,Nominal Hours = 20,,"AURETR025 Test, charge and replace batteries and jump-start vehicles ",Nominal Hours = 15,,AURTTK002 Use and maintain tools and equipment in an automotive workplace ,Nominal Hours = 20,,"AURTTY001 Repair vehicle chassis, frame and associated components ",Nominal Hours = 80,,AURVTN003 Remove and store vehicle body components ,Nominal Hours = 20,,"AURVTN004 Remove, replace and align bolt-on vehicle body panels and components ",Nominal Hours = 90,,AURVTN016 Repair vehicle body panels using filler ,Nominal Hours = 35,,AURVTN020 Remove and replace major welded panels on vehicles ,Nominal Hours = 50,,AURVTN022 Repair vehicle body misalignment ,Nominal Hours = 50,,AURVTN023 Repair adhesive bonded structural damage on vehicles ,Nominal Hours = 40,,AURVTN032 Inspect vehicle damage and determine repair procedures ,Nominal Hours = 40,,AURVTN035 Apply original equipment manufacturer repair procedures during vehicle repairs ,Nominal Hours = 20,,AURVTW003 Carry out advanced gas metal arc welding on vehicle body sections ,Nominal Hours = 30,,AURVTW007 Carry out oxyacetylene thermal heating and cutting on vehicle body sections ,Nominal Hours = 20,,AUMABA002 Operate Load Shifting Equipment ,Nominal Hours = 10,,AUMGTY002 Install Vehicle Components ,Nominal Hours = 60,,AURAFA002 Read and respond to automotive workplace information ,Nominal Hours = 10,,AURAMA001 Work effectively with others in an automotive workplace ,Nominal Hours = 20,,AURETH001 Depower and reinitialise battery electric vehicles ,Nominal Hours = 10,,AURETH011 Depower and reinitialise hybrid electric vehicles ,Nominal Hours = 20,,"AURETR042 Remove, refit and operate electrical components following body repair activities ",Nominal Hours = 20,,AURTTA020 Apply heat induction processes ,Nominal Hours = 20,,AURTTD2004 Inspect And Service Suspension Systems ,Nominal Hours = 10,,AURTTW001 Carry out soft soldering techniques ,Nominal Hours = 20,,AURVTA001 Prepare vehicles for customer use ,Nominal Hours = 20,,AURVTA002 Remove and replace vehicle supplementary restraint systems ,Nominal Hours = 20,,AURVTG010 Remove and install vehicle movable body glass ,Nominal Hours = 15,,AURVTN002 Carry out non-structural vehicle panel repairs ,Nominal Hours = 40,,AURVTN005 Remove and replace adhesive attached components on vehicles ,Nominal Hours = 15,,AURVTN013 Carry out paint-less dent repairs on vehicle body panels ,Nominal Hours = 40,,AURVTN015 Repair vehicle body panels using metal finishing ,Nominal Hours = 35,,AURVTN017 Repair vehicle thermoplastic body panels and components ,Nominal Hours = 30,,AURVTN018 Repair and replace vehicle structural damage ,Nominal Hours = 30,,AURVTN019 Repair vehicle structural damage by riveting ,Nominal Hours = 30,,AURVTN021 Repair vehicle body components using lead wiping ,Nominal Hours = 30,,AURVTN025 Repair corroded vehicle body panels and components ,Nominal Hours = 60,,AURVTN026 Repair vehicle aluminium body panels without the use of body filler ,Nominal Hours = 30,,AURVTN027 Repair vehicle aluminium body panels using filler ,Nominal Hours = 30,
CERTIII,Kangan Batman Institute,Online,Certificate III in Automotive Body Repair Technology,Heavy Commercial Vehicles & Engine Techn,3384,672,16911,,,,AUD,Years,3.0,Years,Yes,Yes,ATAR,IELTS,,,,,https://www.kangan.edu.au/tafe-courses/certificate-iii-in-automotive-body-repair-technology-3152,English,,"You will be advised by your facilitator on a case by case basis in relation to practical and work placement assessments, as some flexibility will be required during this challenging time.The Certificate III in Automotive Body Repair Technology (AUR32116) covers skills and knowledge required to repair and maintain the body of cars, heavy vehicles and other vehicles in the automotive industry.This automotive apprenticeship course provides comprehensive knowledge and skills in the vehicle body fields of panel beating.Click here for course modulesHow will I be assessed?You will be assessed to show that you have achieved the skills and knowledge required by the course. Assessment may include written, oral or practical assessment methods. You will be advised in advance about the type of assessment and the how it will operate. There is the opportunity for reassessment and appeal and you will be provided with this information.","The Certificate III in Automotive Body Repair Technology (AUR32116) prepares you to repair, maintain and remanufacture the body of vehicles in the automotive industry. This course may lead to employment as a:",Australia,Yes,Yes,Yes,Yes,Yes,,,No,AURAEA002 Follow environmental and sustainability best practice in an automotive workplace ,Nominal Hours = 25,,AURAFA008 Interpret and apply automotive repair instructions ,Nominal Hours = 20,,AURASA002 Follow safe working practices in an automotive workplace ,Nominal Hours = 20,,"AURETR025 Test, charge and replace batteries and jump-start vehicles ",Nominal Hours = 15,,AURTTK002 Use and maintain tools and equipment in an automotive workplace ,Nominal Hours = 20,,"AURTTY001 Repair vehicle chassis, frame and associated components ",Nominal Hours = 80,,AURVTN003 Remove and store vehicle body components ,Nominal Hours = 20,,"AURVTN004 Remove, replace and align bolt-on vehicle body panels and components ",Nominal Hours = 90,,AURVTN016 Repair vehicle body panels using filler ,Nominal Hours = 35,,AURVTN020 Remove and replace major welded panels on vehicles ,Nominal Hours = 50,,AURVTN022 Repair vehicle body misalignment ,Nominal Hours = 50,,AURVTN023 Repair adhesive bonded structural damage on vehicles ,Nominal Hours = 40,,AURVTN032 Inspect vehicle damage and determine repair procedures ,Nominal Hours = 40,,AURVTN035 Apply original equipment manufacturer repair procedures during vehicle repairs ,Nominal Hours = 20,,AURVTW003 Carry out advanced gas metal arc welding on vehicle body sections ,Nominal Hours = 30,,AURVTW007 Carry out oxyacetylene thermal heating and cutting on vehicle body sections ,Nominal Hours = 20,,AUMABA002 Operate Load Shifting Equipment ,Nominal Hours = 10,,AUMGTY002 Install Vehicle Components ,Nominal Hours = 60,,AURAFA002 Read and respond to automotive workplace information ,Nominal Hours = 10,,AURAMA001 Work effectively with others in an automotive workplace ,Nominal Hours = 20,,AURETH001 Depower and reinitialise battery electric vehicles ,Nominal Hours = 10,,AURETH011 Depower and reinitialise hybrid electric vehicles ,Nominal Hours = 20,,"AURETR042 Remove, refit and operate electrical components following body repair activities ",Nominal Hours = 20,,AURTTA020 Apply heat induction processes ,Nominal Hours = 20,,AURTTD2004 Inspect And Service Suspension Systems ,Nominal Hours = 10,,AURTTW001 Carry out soft soldering techniques ,Nominal Hours = 20,,AURVTA001 Prepare vehicles for customer use ,Nominal Hours = 20,,AURVTA002 Remove and replace vehicle supplementary restraint systems ,Nominal Hours = 20,,AURVTG010 Remove and install vehicle movable body glass ,Nominal Hours = 15,,AURVTN002 Carry out non-structural vehicle panel repairs ,Nominal Hours = 40,,AURVTN005 Remove and replace adhesive attached components on vehicles ,Nominal Hours = 15,,AURVTN013 Carry out paint-less dent repairs on vehicle body panels ,Nominal Hours = 40,,AURVTN015 Repair vehicle body panels using metal finishing ,Nominal Hours = 35,,AURVTN017 Repair vehicle thermoplastic body panels and components ,Nominal Hours = 30,,AURVTN018 Repair and replace vehicle structural damage ,Nominal Hours = 30,,AURVTN019 Repair vehicle structural damage by riveting ,Nominal Hours = 30,,AURVTN021 Repair vehicle body components using lead wiping ,Nominal Hours = 30,,AURVTN025 Repair corroded vehicle body panels and components ,Nominal Hours = 60,,AURVTN026 Repair vehicle aluminium body panels without the use of body filler ,Nominal Hours = 30,,AURVTN027 Repair vehicle aluminium body panels using filler ,Nominal Hours = 30,
CERTIII,Kangan Batman Institute,Melbourne,Certificate III in Automotive Diesel Engine Technology,Passenger Vehicles,1144,227,5866,1144,227,5866,AUD,Years,3.0,Years,Yes,Yes,ATAR,IELTS,,,,,https://www.kangan.edu.au/tafe-courses/certificate-iii-in-automotive-diesel-engine-technology-3201,English,,"You will be advised by your facilitator on a case by case basis in relation to practical and work placement assessments, as some flexibility will be required during this challenging time.This course will train you to work as a diesel engine technician, working on fixed machinery such as plant generators and pumping stations. You will gain skills to carry out diagnostic procedures, service, and repair and overhaul engines and associated components, repair and service cooling systems, diesel fuel systems, emission control systems and air compressors/components.Click here for course modulesHow will I be assessed?You will be assessed to show that you have achieved the skills and knowledge required by the course. Assessment may include written, oral or practical assessment methods. You will be advised in advance about the type of assessment and the how it will operate. There is the opportunity for reassessment and appeal and you will be provided with this information.",This course is intended to prepare you to perform mechanical work in the diesel engine service and repair sector. This course may lead to employment as a Diesel Engine Technician.,Australia,Yes,Yes,Yes,Yes,Yes,,,No,AURAEA002 Follow environmental and sustainability best practice in an automotive workplace ,Nominal Hours = 25,,AURASA002 Follow safe working practices in an automotive workplace ,Nominal Hours = 20,,AURETR012 Test and repair basic electrical circuits ,Nominal Hours = 40,,"AURETR025 Test, charge and replace batteries and jump-start vehicles ",Nominal Hours = 15,,AURHTE002 Diagnose and repair heavy vehicle compression ignition engines ,Nominal Hours = 70,,AURHTF002 Diagnose and repair heavy vehicle diesel fuel injection systems ,Nominal Hours = 80,,AURTTA004 Carry out servicing operations ,Nominal Hours = 20,,AURTTA018 Carry out diagnostic procedures ,Nominal Hours = 20,,AURTTE004 Inspect and service engines ,Nominal Hours = 20,,AURTTK001 Use and maintain measuring equipment in an automotive workplace ,Nominal Hours = 15,,AURTTK002 Use and maintain tools and equipment in an automotive workplace ,Nominal Hours = 20,,AURTTM004 Assemble engine blocks and sub-assemblies ,Nominal Hours = 70,,AURTTM008 Dismantle and evaluate engine blocks and sub-assemblies ,Nominal Hours = 70,,AURTTM011 Recondition engine cylinder heads ,Nominal Hours = 120,,AURETR024 Diagnose and repair compression ignition engine management systems ,Nominal Hours = 50,,AURETR028 Diagnose and repair instruments and warning systems ,Nominal Hours = 40,,AURETR029 Diagnose and repair charging systems ,Nominal Hours = 30,,AURETR030 Diagnose and repair starting systems ,Nominal Hours = 30,,AURETR032 Diagnose and repair automotive electrical systems ,Nominal Hours = 80,,AURHTB002 Diagnose and repair heavy vehicle hydraulic and air over hydraulic braking systems ,Nominal Hours = 40,,AURHTE001 Remove and install heavy vehicle engine assemblies ,Nominal Hours = 35,,"AURHTJ006 Remove, inspect, repair and refit heavy vehicle tyres and tubes ",Nominal Hours = 40,,AURHTX004 Diagnose and repair heavy vehicle clutch systems ,Nominal Hours = 35,,AURHTZ001 Diagnose and repair heavy vehicle emission control systems ,Nominal Hours = 20,,"AURTTA005 Select and use bearings, seals, gaskets, sealants and adhesives ",Nominal Hours = 10,,AURTTA006 Inspect and service hydraulic systems ,Nominal Hours = 20,,AURTTA012 Fabricate and install fluid power hose assemblies ,Nominal Hours = 10,,AURTTA013 Diagnose and repair hydraulic systems ,Nominal Hours = 60,,AURTTB001 Inspect and service braking systems ,Nominal Hours = 20,,AURTTC003 Diagnose and repair cooling systems ,Nominal Hours = 20,,AURTTF002 Inspect and service diesel fuel injection systems ,Nominal Hours = 20,,AURTTF005 Diagnose and repair engine forced-induction systems ,Nominal Hours = 15,,AURVTW001 Carry out manual metal arc welding on components ,Nominal Hours = 30,,"AURVTW008 Carry out oxyacetylene welding, thermal heating and cutting ",Nominal Hours = 30,,AURVTW009 Carry out basic gas metal arc welding ,Nominal Hours = 20,,,,,,,,,,,,,,,,
