CERTIV,Kangan Batman Institute,Melbourne,Certificate IV In Dental Assisting,Health CoE,6174,1234,11266,6174,1234,11266,AUD,Years,1.0,Year,Yes,Yes,ATAR,IELTS,,,,,https://www.kangan.edu.au/tafe-courses/certificate-iv-in-dental-assisting-3258,English,,"This qualification provides the knowledge and skills needed to provide an advanced level of chair-side assistance to a Dentist, Dental Hygienist, Dental Prosthetist, Dental Therapist or Oral Health Therapist, which contributes to the quality of oral health care.Additional specialised training and skills will be gained by successfully completing one of the elective specialisation.Completion of the Radiography specialisation will enable the dental assistant to apply to the Department of Health (Victoria) for a licence to take both intra-oral and extra-oral radiographs under request from a licensed Dental PractitionerCompletion of the Oral Health Promotion specialisation will enable the dental assistant to provide a higher level of oral health instruction and guidance to patients, oral health promotion and implement an oral hygiene programDelivery combines work experience and flexible training to competently and safely assist the dental professional during oral health care procedures.Course duration is full-time 1 year, part-time 2 years.Free TAFE and JobTrainerYou may be entitled to free tuition fees for this course if you meet the eligibility criteria for the State Government’s FREE TAFE for Priority Courses initiative. If you are aged 17-24 or looking for work, you may be eligible to study this course low-fee through JobTrainer. It's important to know that you may incur other fees, such as student services fees or materials fees, and you'll need to cover these costs yourself. To find out more, call 13 TAFE (13 8233) or contact us via our online enquiry form.Click here for course modulesHow will I be assessed?You will be assessed to show that you have achieved the skills and knowledge required by the course. Assessment may include, demonstration, written, oral or practical assessment methods. You will know in advance about the type of assessment and how it will operate. There is the opportunity for reassessment and appeal and you will be given this information.What will I study?Areas of study include: assisting with oral health care procedures and dental radiography; communication and administration in the dental practice; workplace health & safety and infection control.","This course may lead to employment as a Dental Assistant, Dental Hygienist, Dental Therapist, Oral Health Specialist.",Australia,No,Yes,No,Yes,No,,,Yes,CHCCOM005 Communicate and work in health or community services ,Nominal Hours = 30,,CHCDIV001 Work with diverse people ,Nominal Hours = 40,,HLTAID003 Provide First Aid ,Nominal Hours = 18,,HLTDEN001 Prepare for and assist with oral health care procedures ,Nominal Hours = 300,,HLTDEN002 Assist with dental radiography ,Nominal Hours = 50,,HLTDEN003 Assist with administration in dental practice ,Nominal Hours = 40,,HLTDEN004 Implement an individualised oral hygiene program ,Nominal Hours = 330,,HLTDEN007 Apply the principles of radiation biology and protection in dental practice ,Nominal Hours = 120,,HLTDEN008 Prepare to expose a prescribed dental radiographic image ,Nominal Hours = 90,,HLTDEN009 Produce a prescribed dental radiographic image ,Nominal Hours = 130,,HLTDEN010 Implement an oral hygiene program for older people ,Nominal Hours = 130,,HLTDEN011 Implement an oral health promotion program ,Nominal Hours = 130,,HLTINF001 Comply with infection prevention and control policies and procedures ,Nominal Hours = 25,,HLTINF002 Process reusable medical devices and equipment ,Nominal Hours = 30,,HLTINF003 Implement and monitor infection prevention and control policies and procedures ,Nominal Hours = 60,,HLTOHC004 Provide or assist with oral hygiene ,Nominal Hours = 50,,HLTWHS003 Maintain Work Health And Safety ,Nominal Hours = 40,,,,,,,,,,,,,,,,,,,,,,,,,,,,,,,,,,,,,,,,,,,,,,,,,,,,,,,,,,,,,,,,,,,,,,
CERTIV,Kangan Batman Institute,Melbourne,Certificate IV In Disability,Community CoE,1729,345,7771,1729,345,7371,AUD,Years,9.0,Months,Yes,No,ATAR,IELTS,,,,,https://www.kangan.edu.au/tafe-courses/certificate-iv-in-disability-3078,English,,"Classes are delivered remotely online with several workshops for practical classes and assessments.Start Date: 1 February 2021End Date: 30 September 2021*For applicants who are currently working in the Disability Industry1 day per week: Wednesday 9am - 4;30pmPractical Placement will be completed in the workplace.Essendon campus Full time: 9 monthsClasses are delivered remotely online with several workshops for practical classes and assessments.Start Date: 19 April 2021End Date: 6 December 20212 Days per week: Monday & Thursday 9:30am - 4:30pmWith our nationally accredited qualification, you can develop your skills to assist people with a disability to achieve greater levels of independence and enjoy an increased quality of life. It’s a selfless career choice – and we want to support you in your chosen occupation as much as possible.The course is delivered flexibly, suited to your particular needs. There is a work placement component of 120 hours embedded within the course.  We design some assessments to be completed in your workplace or completed online and plan for your attendance at Kangan Institute to be as work friendly as possible. We can also organise work placement opportunities that are interesting, suit your needs and give you an insight into future careers paths.Before you can start your practical placement, you will need to provide the following compulsory requirements:•       A valid Working with Children Check (Volunteer)•       A satisfactory National Police Check – National Police checks are conducted via fit2work. An account with fit2work will be created using the student’s name and the Kangan Institute issued student email address, once studies in the program have commenced. Further information will be provided once enrolment has been completed.Free TAFE and JobTrainerYou may be entitled to free tuition fees for this course if you meet the eligibility criteria for the State Government’s FREE TAFE for Priority Courses initiative. If you are aged 17-24 or looking for work, you may be eligible to study this course low-fee through JobTrainer. It's important to know that you may incur other fees, such as student services fees or materials fees, and you'll need to cover these costs yourself. To find out more, call 13 TAFE (13 8233) or contact us via our online enquiry form.Click here for course modulesHow will I be assessed?You are assessed through a mixture of practical tutorials and project work, as well as online and written assessments. Workplace assessments will also be conducted in either your workplace or during your placement. Assessment is a necessary part of the program to show that you have achieved the skills and knowledge set out in the competency standards.Additional commentsPlease register your enquiry by applying online. You can also call us on 13 TAFE (13 8233) if you have any questions.What will I study?This qualification consists of 15 units. (Please refer to Course Modules).",A Certificate IV in Disability qualification allows you to work as a: Behavioural support officer Development officer Project officer (life enhancement team) Disability officer - day support Residential care officer Disability support officer / worker Senior personal care assistant Employment coordinator (disability) Social educator Job coordinator Lifestyle support officer - special schools,Australia,No,Yes,No,Yes,No,,,Yes,CHCCCS015 Provide individualised support ,Nominal Hours = 30,,CHCDIS002 Follow established person-centred behaviour supports ,Nominal Hours = 50,,CHCDIS005 Develop and provide person-centred service responses ,Nominal Hours = 135,,CHCDIS007 Facilitate the empowerment of people with disability ,Nominal Hours = 100,,CHCDIS008 Facilitate community participation and social inclusion ,Nominal Hours = 60,,CHCDIS009 Facilitate ongoing skills development using a person-centred approach ,Nominal Hours = 50,,CHCDIS010 Provide person-centred services to people with disability with complex needs ,Nominal Hours = 90,,CHCDIV001 Work with diverse people ,Nominal Hours = 40,,CHCLEG003 Manage legal and ethical compliance ,Nominal Hours = 80,,HLTAAP001 Recognise healthy body systems ,Nominal Hours = 70,,HLTWHS002 Follow safe work practices for direct client care ,Nominal Hours = 25,,CHCCCS011 Meet personal support needs ,Nominal Hours = 60,,CHCCCS021 Respond to suspected abuse ,Nominal Hours = 60,,CHCDIS004 Communicate using augmentative and alternative communication strategies ,Nominal Hours = 60,,,,,,,,,,,,,,,,,,,,,,,,,,,,,,,,,,,,,,,,,,,,,,,,,,,,,,,,,,,,,,,,,,,,,,,,,,,,,,,
CERTIV,Kangan Batman Institute,Melbourne,Certificate IV In Engineering,Construction & Engineering,,,,5153,1024,24585,AUD,Years,2.0,Years,Yes,Yes,ATAR,IELTS,,,,,https://www.kangan.edu.au/tafe-courses/certificate-iv-in-engineering-1576,English,,"You will be advised by your facilitator on a case by case basis in relation to practical and work placement assessments, as some flexibility will be required during this challenging time.A Certificate IV in Engineering (MEM40105), known as Higher Engineering Trade, is a continuation of a trade course (certificate III) at a higher level. The course will cover higher level post-trade skills such as computer controlled machining or advanced welding, fluid power and AutoCAD.This engineering course enables you to become a qualified Higher Engineering Tradesperson.The Certificate IV in Engineering (MEM40105) is a part-time course spanning 4 years, offered at our Broadmeadows and Richmond campuses within our dedicated training facilities, comprising of new and modern machinery, ensuring what you learn on campus reflects industry standards. As a large educational provider, our students also have access to a wide range of student support services and resources such as the Library and Learning Centre as well as our very own Employment Centre to ensure that your study experience is a positive one.Free TAFE and JobTrainerYou may be entitled to free tuition fees for this course if you meet the eligibility criteria for the State Government’s FREE TAFE for Priority Courses initiative. If you are aged 17-24 or looking for work, you may be eligible to study this course low-fee through JobTrainer. It's important to know that you may incur other fees, such as student services fees or materials fees, and you'll need to cover these costs yourself. To find out more, call 13 TAFE (13 8233) or contact us via our online enquiry form.Click here for course modulesHow will I be assessed?A mixture of practical tutorials, project work and written tests will be used in assessing this course. Assessment is a necessary part of this program, to show that you have achieved the skills and knowledge set out in the competency standards.You will be advised in advance about the assessment procedure and criteria. There will also be opportunity for appeal and reassessment and you will be provided with this information.What will I study?Certificate IV in Engineering is a work-based training program involving completion of competency units amounting to 136 points. There are a number of standard core competencies to be completed but most competencies are chosen to suit the type of employment. The available competencies are listed in the Industry Handbook for the Metal; Engineering Training Package.",The advanced skills gained in this course will mean advanced trade qualifications leading to better career development possibilities in the relevant trade.,Australia,Yes,Yes,Yes,Yes,Yes,,,Yes,MEM10.4B ENTER AND CHANGE PROGRAMMABLE CONTROLLER OPERATIONAL PARAMETERS ,Nominal Hours = 20,,MEM10.5B COMMISSION PROGRAMMABLE CONTROLLER PROGRAMS ,Nominal Hours = 40,,MEM16.10A WRITE REPORTS ,Nominal Hours = 20,,MEM18.18C MAINTAIN PNEUMATIC SYSTEM COMPONENTS ,Nominal Hours = 38,,MEM18.19B MAINTAIN PNEUMATIC SYSTEMS ,Nominal Hours = 40,,MEM18.1C USE HAND TOOLS ,Nominal Hours = 20,,MEM18.20B MAINTAIN HYDRAULIC SYSTEM COMPONENTS ,Nominal Hours = 40,,MEM18.21B MAINTAIN HYDRAULIC SYSTEMS ,Nominal Hours = 40,,MEM18.22B MAINTAIN FLUID POWER CONTROLS ,Nominal Hours = 80,,MEM18.23B MODIFY FLUID POWER SYSTEM OPERATION ,Nominal Hours = 80,,MEM18.2B USE POWER TOOLS/HAND HELD OPERATIONS ,Nominal Hours = 20,,MEM18.3C USE TOOLS FOR PRECISION WORK ,Nominal Hours = 40,,MEM18.53B MODIFY FLUID POWER CONTROL SYSTEMS ,Nominal Hours = 60,,MEM18.6B REPAIR AND FIT ENGINEERING COMPONENTS ,Nominal Hours = 60,,MEM7.18C WRITE BASIC NC/CNC PROGRAMS ,Nominal Hours = 40,,MEM7.19C PROGRAM NC/CNC MACHINING CENTRE ,Nominal Hours = 20,,MEM7.24B OPERATE AND MONITOR MACHINE/PROCESS ,Nominal Hours = 40,,MEM7.28B OPERATE COMPUTER CONTROLLED MACHINES/PROCESSES ,Nominal Hours = 20,,MEM7.5B PERFORM GENERAL MACHINING ,Nominal Hours = 80,,MEM7.6B PERFORM LATHE OPERATIONS ,Nominal Hours = 40,,MEM9.10C CREATE 3D MODELS USING COMPUTER AIDED DESIGN SYSTEM ,Nominal Hours = 40,,MEM9.2B INTERPRET TECHNICAL DRAWING ,Nominal Hours = 40,,MEM9.3B PREPARE BASIC ENGINEERING DRAWING ,Nominal Hours = 80,,MEM9.9C CREATE 2D DRAWINGS USING COMPUTER AIDED DESIGN SYSTEM ,Nominal Hours = 80,,,,,,,,,,,,,,,,,,,,,,,,,,,,,,,,,,,,,,,,,,,,,,,,,
CERTIV,Kangan Batman Institute,Online,Certificate IV In Engineering,Construction & Engineering,,,,5153,1024,24585,AUD,Years,2.0,Years,Yes,Yes,ATAR,IELTS,,,,,https://www.kangan.edu.au/tafe-courses/certificate-iv-in-engineering-1576,English,,"You will be advised by your facilitator on a case by case basis in relation to practical and work placement assessments, as some flexibility will be required during this challenging time.A Certificate IV in Engineering (MEM40105), known as Higher Engineering Trade, is a continuation of a trade course (certificate III) at a higher level. The course will cover higher level post-trade skills such as computer controlled machining or advanced welding, fluid power and AutoCAD.This engineering course enables you to become a qualified Higher Engineering Tradesperson.The Certificate IV in Engineering (MEM40105) is a part-time course spanning 4 years, offered at our Broadmeadows and Richmond campuses within our dedicated training facilities, comprising of new and modern machinery, ensuring what you learn on campus reflects industry standards. As a large educational provider, our students also have access to a wide range of student support services and resources such as the Library and Learning Centre as well as our very own Employment Centre to ensure that your study experience is a positive one.Free TAFE and JobTrainerYou may be entitled to free tuition fees for this course if you meet the eligibility criteria for the State Government’s FREE TAFE for Priority Courses initiative. If you are aged 17-24 or looking for work, you may be eligible to study this course low-fee through JobTrainer. It's important to know that you may incur other fees, such as student services fees or materials fees, and you'll need to cover these costs yourself. To find out more, call 13 TAFE (13 8233) or contact us via our online enquiry form.Click here for course modulesHow will I be assessed?A mixture of practical tutorials, project work and written tests will be used in assessing this course. Assessment is a necessary part of this program, to show that you have achieved the skills and knowledge set out in the competency standards.You will be advised in advance about the assessment procedure and criteria. There will also be opportunity for appeal and reassessment and you will be provided with this information.What will I study?Certificate IV in Engineering is a work-based training program involving completion of competency units amounting to 136 points. There are a number of standard core competencies to be completed but most competencies are chosen to suit the type of employment. The available competencies are listed in the Industry Handbook for the Metal; Engineering Training Package.",The advanced skills gained in this course will mean advanced trade qualifications leading to better career development possibilities in the relevant trade.,Australia,Yes,Yes,Yes,Yes,Yes,,,Yes,MEM10.4B ENTER AND CHANGE PROGRAMMABLE CONTROLLER OPERATIONAL PARAMETERS ,Nominal Hours = 20,,MEM10.5B COMMISSION PROGRAMMABLE CONTROLLER PROGRAMS ,Nominal Hours = 40,,MEM16.10A WRITE REPORTS ,Nominal Hours = 20,,MEM18.18C MAINTAIN PNEUMATIC SYSTEM COMPONENTS ,Nominal Hours = 38,,MEM18.19B MAINTAIN PNEUMATIC SYSTEMS ,Nominal Hours = 40,,MEM18.1C USE HAND TOOLS ,Nominal Hours = 20,,MEM18.20B MAINTAIN HYDRAULIC SYSTEM COMPONENTS ,Nominal Hours = 40,,MEM18.21B MAINTAIN HYDRAULIC SYSTEMS ,Nominal Hours = 40,,MEM18.22B MAINTAIN FLUID POWER CONTROLS ,Nominal Hours = 80,,MEM18.23B MODIFY FLUID POWER SYSTEM OPERATION ,Nominal Hours = 80,,MEM18.2B USE POWER TOOLS/HAND HELD OPERATIONS ,Nominal Hours = 20,,MEM18.3C USE TOOLS FOR PRECISION WORK ,Nominal Hours = 40,,MEM18.53B MODIFY FLUID POWER CONTROL SYSTEMS ,Nominal Hours = 60,,MEM18.6B REPAIR AND FIT ENGINEERING COMPONENTS ,Nominal Hours = 60,,MEM7.18C WRITE BASIC NC/CNC PROGRAMS ,Nominal Hours = 40,,MEM7.19C PROGRAM NC/CNC MACHINING CENTRE ,Nominal Hours = 20,,MEM7.24B OPERATE AND MONITOR MACHINE/PROCESS ,Nominal Hours = 40,,MEM7.28B OPERATE COMPUTER CONTROLLED MACHINES/PROCESSES ,Nominal Hours = 20,,MEM7.5B PERFORM GENERAL MACHINING ,Nominal Hours = 80,,MEM7.6B PERFORM LATHE OPERATIONS ,Nominal Hours = 40,,MEM9.10C CREATE 3D MODELS USING COMPUTER AIDED DESIGN SYSTEM ,Nominal Hours = 40,,MEM9.2B INTERPRET TECHNICAL DRAWING ,Nominal Hours = 40,,MEM9.3B PREPARE BASIC ENGINEERING DRAWING ,Nominal Hours = 80,,MEM9.9C CREATE 2D DRAWINGS USING COMPUTER AIDED DESIGN SYSTEM ,Nominal Hours = 80,,,,,,,,,,,,,,,,,,,,,,,,,,,,,,,,,,,,,,,,,,,,,,,,,
CERTIV,Kangan Batman Institute,Melbourne,Certificate IV In Hospitality,"Professional, Creative & Environment",4613,924,9219,,,,AUD,Years,6.0,Months,Yes,No,ATAR,IELTS,,,,,https://www.kangan.edu.au/tafe-courses/certificate-iv-in-hospitality-3123,English,,"With the tourism sector’s continued growth, there are many job openings both here in Australia and overseas, and the industry offers plenty of opportunities for progression for people with the right attitude, qualifications and experience.The nationally recognised Certificate IV in Hospitality (SIT40416) will help you to develop the practical skills and experience needed to secure an entry-level position within this exciting field.As part of your training, you’ll enjoy 12 weeks work placement at Mantra Hotel Tullamarine, where you’ll gain real-world experience in a four star hotel.  You’ll also hone your skills in our fully-operational licensed training restaurant at our Broadmeadows campus.The course covers all areas of front of house operations including housekeeping, food and beverage, sales, events and customer service.Our students graduate as highly employable professionals ready to take the next step in a rewarding and exciting career in the hospitality industry.A number of our top performing students have been offered positions at Mantra Hotel Tullamarine upon completion of their studies.If you want to continue your studies after you graduate, you can go on to complete the Diploma of Hospitality Management (SIT50416)Find out what our students say about studying Hospitality at Kangan Institute here.Click here for course modulesHow will I be assessed?You will be assessed to check that you have achieved the skills and knowledge required by the course. Assessment may include written, oral or practical assessment methods. You will know in advance about the type of assessment and how it will operate. There is the opportunity for reassessment and appeal and you will be given this information.What will I study?This course covers all areas of front of house operations including housekeeping, food and beverage, sales, events and customer service.","This course is designed to give you the skills and experience to secure an entry-level position in a hospitality organisation such as a restaurant, hotel, motel, club, pub, café or coffee shop.",Australia,No,Yes,No,Yes,No,,,No,BSBDIV501 Manage Diversity In The Workplace ,Nominal Hours = 60,,SITHIND004 Work effectively in hospitality service ,Nominal Hours = 0,,SITXCCS007 Enhance customer service experiences ,Nominal Hours = 40,,SITXCOM005 Manage conflict ,Nominal Hours = 20,,SITXFIN003 Manage finances within a budget ,Nominal Hours = 30,,SITXHRM001 Coach others in job skills ,Nominal Hours = 20,,SITXHRM003 Lead and manage people ,Nominal Hours = 60,,SITXMGT001 Monitor work operations ,Nominal Hours = 20,,SITXWHS003 Implement and monitor work health and safety practices ,Nominal Hours = 30,,BSBITU306 Design And Produce Business Documents ,Nominal Hours = 80,,SITHACS001 Clean premises and equipment ,Nominal Hours = 15,,SITHACS002 Provide housekeeping services to guests ,Nominal Hours = 10,,SITHACS003 Prepare rooms for guests ,Nominal Hours = 25,,SITHFAB001 Clean and tidy bar areas ,Nominal Hours = 15,,SITHFAB002 Provide responsible service of alcohol ,Nominal Hours = 10,,SITHFAB003 Operate a bar ,Nominal Hours = 35,,SITHFAB007 Serve food and beverage ,Nominal Hours = 80,,SITHFAB014 Provide table service of food and beverage ,Nominal Hours = 110,,SITHFAB019 Plan and monitor espresso coffee service ,Nominal Hours = 80,,SITXCCS002 Provide visitor information ,Nominal Hours = 35,,SITXFSA001 Use hygienic practices for food safety ,Nominal Hours = 15,,,,,,,,,,,,,,,,,,,,,,,,,,,,,,,,,,,,,,,,,,,,,,,,,,,,,,,,,,
CERTIV,Kangan Batman Institute,Melbourne,Certificate IV In Laboratory Techniques,Food & Fibre,3097,619,12169,,,,AUD,Years,1.0,Year,Yes,No,ATAR,IELTS,,,,,https://www.kangan.edu.au/tafe-courses/certificate-iv-in-laboratory-techniques-3342,English,,"You will achieve the skills and knowledge of performing aseptic techniques, microscopic examination, microbiological tests, food tests, chemical tests, and biological procedures. You will also become familiar with processing and interpreting data, planing and conducting laboratory work, calibrating laboratory instruments and equipment, carrying out sampling, testing and other laboratory related tasks.Watch our Recorded Information Session to learn more about this course including career opportunities, work placements, fees and more - Watch HereThis course may also have a mid-year intake.JobTrainerIf you are aged 17-24 or looking for work, you may be eligible to study this course low-fee through JobTrainer. It's important to know that you may incur other fees, such as student services fees and materials fees, and you'll need to cover these costs yourself. To find out more, call 13 TAFE (13 8233) or contact us via our online enquiry form.Click here for course modulesHow will I be assessed?You will be assessed to show that you have achieved the skills and knowledge required by the course.Assessment may include written, oral or practical assessment methods. You will know in advance about the type of assessment and how it will operate.There is the opportunity for reassessment and appeal and you will be given this information.What will I study?You will be required to study 5 core units and 10 elective units:Core units include:","This course may lead to employment as technical assistant, laboratory technician, technical officer, laboratory analyst, forensic science technician, sample tester, sample preparation assistant, instrument operator and similar personnel in a diverse range of industries such as Agriculture, Biotechnology, Food & Beverage, Health, Pharmaceutical company, Education & Training organisations, Local councils, Manufacturing, Construction, Environment, Mining and Forensic Science.",Australia,No,Yes,No,Yes,No,,,No,MSL924003 Process and interpret data ,Nominal Hours = 70,,MSL934004 Maintain and calibrate instruments and equipment ,Nominal Hours = 60,,MSL934006 Apply quality system and continuous improvement processes ,Nominal Hours = 80,,MSL944002 Maintain laboratory or field workplace safety ,Nominal Hours = 50,,MSL953003 Receive and prepare samples for testing ,Nominal Hours = 30,,MSL913003 Communicate with other people ,Nominal Hours = 40,,MSL914002 Prepare practical science classes and demonstrations ,Nominal Hours = 60,,MSL973016 Perform aseptic techniques ,Nominal Hours = 40,,MSL973019 Perform microscopic examination ,Nominal Hours = 40,,"MSL974017 Prepare, standardise and use solutions ",Nominal Hours = 100,,MSL974019 Perform chemical tests and procedures ,Nominal Hours = 100,,MSL974020 Perform food tests ,Nominal Hours = 100,,MSL974021 Perform biological procedures ,Nominal Hours = 130,,MSL975035 Perform microbiological tests ,Nominal Hours = 140,,MSMENV472 Implement and monitor environmentally sustainable work practices ,Nominal Hours = 40,,,,,,,,,,,,,,,,,,,,,,,,,,,,,,,,,,,,,,,,,,,,,,,,,,,,,,,,,,,,,,,,,,,,,,,,,,,,
