CERTIII,Kangan Batman Institute,Online,Certificate III In Hairdressing,Creative Industries,4508,901,12397,3204,637,12397,AUD,Years,3.0,Years,Yes,No,ATAR,IELTS,,,,,https://www.kangan.edu.au/tafe-courses/certificate-iii-in-hairdressing-3182,English,,"Industry leaders like multiple Australian Hairdresser of the Year winner Joey Scandizzo choose Kangan Institute help facilitate their apprentices’ training.  Study hairdressing with us and you’ll learn the techniques used by Australia’s most sought after stylists.The Certificate III in Hairdressing (SHB30416) is designed to give you the skills and hands-on experience required to work in any top salon as a qualified hairdresser.You will learn how to:Kangan Institute also offers the Certificate III in Barbering (SHB30516).JobTrainerIf you are aged 17-24 or looking for work, you may be eligible to study this course low-fee through JobTrainer. It's important to know that you may incur other fees, such as student services fees and materials fees, and you'll need to cover these costs yourself. To find out more, call 13 TAFE (13 8233) or contact us via our online enquiry form.Click here for course modules",This course leads to employment as a hairdresser in a hairdressing salon. You may also work as a session stylist for photography shoots or as a hairdresser in film and television.,Australia,Yes,Yes,Yes,Yes,Yes,,,No,BSBSUS201 Participate In Environmentally Sustainable Work Practices ,Nominal Hours = 20,,SHBHBAS001 Provide shampoo and basin services ,Nominal Hours = 40,,SHBHCLS002 Colour and lighten hair ,Nominal Hours = 65,,SHBHCLS003 Provide full and partial head highlighting treatments ,Nominal Hours = 45,,SHBHCLS004 Neutralise unwanted colours and tones ,Nominal Hours = 55,,SHBHCLS005 Provide on scalp full head and retouch bleach treatments ,Nominal Hours = 55,,SHBHCUT001 Design haircut structures ,Nominal Hours = 20,,SHBHCUT002 Create one length or solid haircut structures ,Nominal Hours = 30,,SHBHCUT003 Create graduated haircut structures ,Nominal Hours = 35,,SHBHCUT004 Create layered haircut structures ,Nominal Hours = 35,,SHBHCUT005 Cut hair using over-comb techniques ,Nominal Hours = 30,,SHBHDES003 Create finished hair designs ,Nominal Hours = 50,,"SHBHIND001 Maintain and organise tools, equipment and work areas ",Nominal Hours = 20,,SHBHIND003 Develop and expand a client base ,Nominal Hours = 35,,SHBHREF002 Straighten and relax hair with chemical treatments ,Nominal Hours = 45,,SHBHTRI001 Identify and treat hair and scalp conditions ,Nominal Hours = 25,,SHBXCCS001 Conduct salon financial transactions ,Nominal Hours = 25,,SHBXCCS002 Provide salon services to clients ,Nominal Hours = 40,,SHBXIND001 Comply with organisational requirements within a personal services environment ,Nominal Hours = 45,,SHBXIND002 Communicate as part of a salon team ,Nominal Hours = 30,,"SHBXWHS001 Apply safe hygiene, health and work practices ",Nominal Hours = 40,,SHBHCCS001 Plan hair services for special events ,Nominal Hours = 20,,SHBHCUT006 Create combined haircut structures ,Nominal Hours = 45,,SHBHCUT007 Create combined traditional and classic men's haircut structures ,Nominal Hours = 45,,SHBHCUT011 Design and maintain beards and moustaches ,Nominal Hours = 20,,SHBHDES004 Create classic long hair up-styles ,Nominal Hours = 30,,SHBHIND002 Research and use hairdressing industry information ,Nominal Hours = 15,,SHBXCCS004 Recommend products and services ,Nominal Hours = 20,,,,,,,,,,,,,,,,,,,,,,,,,,,,,,,,,,,,,
CERTIII,Kangan Batman Institute,Melbourne,Certificate III In Health Services Assistance,Health CoE,1469,295,2963,,,,AUD,Years,23.0,Weeks,Yes,No,ATAR,IELTS,,,,,https://www.kangan.edu.au/tafe-courses/certificate-iii-in-health-services-assistance-3085,English,,"Practical Placement is a mandatory component of this course. Kangan Institute will make efforts to secure an appropriate placement. Due to the current environment and circumstances outside our control, placements may be delayed. This may then impact the completion dates for this course and deferment of graduation.If you want to work in a health care environment, supporting other health care professionals, our Certificate III in Health Services Assistance (HLT33115) is a great foundation course for you.A Health Services Assistant will use a range of technical and procedural knowledge to provide assistance to health professionals for the care and support of patients/clients and will be under direct supervision when dealing with patients/clients.As a Health Service Assistant you will be required to assist nursing staff in delivery of services such as:You will also be required to undertake a minimum of 120 hours of mandatory work placement.Before you can start your practical placement, you will need to provide the following compulsory requirements:•       A valid Working with Children Check (Volunteer)•       A satisfactory National Police Check – National Police checks are conducted via fit2work. An account with fit2work will be created using the student’s name and the Kangan Institute issued student email address, once studies in the program have commenced. Further information will be provided once enrolment has been completed.•       An up to date immunisation/vaccination record as per course requirementsOnce you have finished, you can also decide to continue your studies with any number of exciting courses, including the Certificate IV in Allied Health Assistance (HLT43015)Free TAFE and JobTrainerYou may be entitled to free tuition fees for this course if you meet the eligibility criteria for the State Government’s FREE TAFE for Priority Courses initiative. If you are aged 17-24 or looking for work, you may be eligible to study this course low-fee through JobTrainer. It's important to know that you may incur other fees, such as student services fees or materials fees, and you'll need to cover these costs yourself. To find out more, call 13 TAFE (13 8233) or contact us via our online enquiry form.Click here for course modulesHow will I be assessed?Applicants are invited to register online. You will then be invited to sit a literacy and numeracy assessment.Students need to be able to demonstrate:Additional commentsApplicants wishing to apply for the next intake are required to submit their application online via the Kangan Institute website.What will I study?See units of competency.","Graduates will find job opportunities in support services, food services, cleaning and patient transport and particularly in environmental services.",Australia,No,Yes,No,Yes,No,,,Yes,BSBMED301 Interpret And Apply Medical Terminology Appropriately ,Nominal Hours = 60,,BSBWOR301 Organise personal work priorities and development ,Nominal Hours = 30,,CHCCOM005 Communicate and work in health or community services ,Nominal Hours = 30,,CHCDIV001 Work with diverse people ,Nominal Hours = 40,,HLTAAP001 Recognise healthy body systems ,Nominal Hours = 70,,HLTINF001 Comply with infection prevention and control policies and procedures ,Nominal Hours = 25,,HLTWHS001 Participate in workplace health and safety ,Nominal Hours = 20,,BSBFLM312 Contribute To Team Effectiveness ,Nominal Hours = 40,,CHCCCS002 Assist with movement ,Nominal Hours = 25,,CHCCCS010 Maintain a high standard of service ,Nominal Hours = 30,,CHCCCS012 Prepare and maintain beds ,Nominal Hours = 15,,CHCCCS026 Transport individuals ,Nominal Hours = 20,,HLTFSE001 Follow basic food safety practices ,Nominal Hours = 30,,HLTFSE002 Provide ward or unit based food preparation and distribution services ,Nominal Hours = 30,,HLTHSS003 Perform general cleaning tasks in a clinical setting ,Nominal Hours = 20,,,,,,,,,,,,,,,,,,,,,,,,,,,,,,,,,,,,,,,,,,,,,,,,,,,,,,,,,,,,,,,,,,,,,,,,,,,,
CERTIII,Kangan Batman Institute,Workplace,Certificate III In Health Services Assistance,Health CoE,1469,295,2963,,,,AUD,Years,23.0,Weeks,Yes,No,ATAR,IELTS,,,,,https://www.kangan.edu.au/tafe-courses/certificate-iii-in-health-services-assistance-3085,English,,"Practical Placement is a mandatory component of this course. Kangan Institute will make efforts to secure an appropriate placement. Due to the current environment and circumstances outside our control, placements may be delayed. This may then impact the completion dates for this course and deferment of graduation.If you want to work in a health care environment, supporting other health care professionals, our Certificate III in Health Services Assistance (HLT33115) is a great foundation course for you.A Health Services Assistant will use a range of technical and procedural knowledge to provide assistance to health professionals for the care and support of patients/clients and will be under direct supervision when dealing with patients/clients.As a Health Service Assistant you will be required to assist nursing staff in delivery of services such as:You will also be required to undertake a minimum of 120 hours of mandatory work placement.Before you can start your practical placement, you will need to provide the following compulsory requirements:•       A valid Working with Children Check (Volunteer)•       A satisfactory National Police Check – National Police checks are conducted via fit2work. An account with fit2work will be created using the student’s name and the Kangan Institute issued student email address, once studies in the program have commenced. Further information will be provided once enrolment has been completed.•       An up to date immunisation/vaccination record as per course requirementsOnce you have finished, you can also decide to continue your studies with any number of exciting courses, including the Certificate IV in Allied Health Assistance (HLT43015)Free TAFE and JobTrainerYou may be entitled to free tuition fees for this course if you meet the eligibility criteria for the State Government’s FREE TAFE for Priority Courses initiative. If you are aged 17-24 or looking for work, you may be eligible to study this course low-fee through JobTrainer. It's important to know that you may incur other fees, such as student services fees or materials fees, and you'll need to cover these costs yourself. To find out more, call 13 TAFE (13 8233) or contact us via our online enquiry form.Click here for course modulesHow will I be assessed?Applicants are invited to register online. You will then be invited to sit a literacy and numeracy assessment.Students need to be able to demonstrate:Additional commentsApplicants wishing to apply for the next intake are required to submit their application online via the Kangan Institute website.What will I study?See units of competency.","Graduates will find job opportunities in support services, food services, cleaning and patient transport and particularly in environmental services.",Australia,No,Yes,No,Yes,No,,,Yes,BSBMED301 Interpret And Apply Medical Terminology Appropriately ,Nominal Hours = 60,,BSBWOR301 Organise personal work priorities and development ,Nominal Hours = 30,,CHCCOM005 Communicate and work in health or community services ,Nominal Hours = 30,,CHCDIV001 Work with diverse people ,Nominal Hours = 40,,HLTAAP001 Recognise healthy body systems ,Nominal Hours = 70,,HLTINF001 Comply with infection prevention and control policies and procedures ,Nominal Hours = 25,,HLTWHS001 Participate in workplace health and safety ,Nominal Hours = 20,,BSBFLM312 Contribute To Team Effectiveness ,Nominal Hours = 40,,CHCCCS002 Assist with movement ,Nominal Hours = 25,,CHCCCS010 Maintain a high standard of service ,Nominal Hours = 30,,CHCCCS012 Prepare and maintain beds ,Nominal Hours = 15,,CHCCCS026 Transport individuals ,Nominal Hours = 20,,HLTFSE001 Follow basic food safety practices ,Nominal Hours = 30,,HLTFSE002 Provide ward or unit based food preparation and distribution services ,Nominal Hours = 30,,HLTHSS003 Perform general cleaning tasks in a clinical setting ,Nominal Hours = 20,,,,,,,,,,,,,,,,,,,,,,,,,,,,,,,,,,,,,,,,,,,,,,,,,,,,,,,,,,,,,,,,,,,,,,,,,,,,
CERTIII,Kangan Batman Institute,Melbourne,Certificate III in Heavy Commercial Trailer Technology,Heavy Commercial Vehicles & Engine Techn,1144,227,5866,1144,227,5866,AUD,Years,3.0,Years,Yes,Yes,ATAR,IELTS,,,,,https://www.kangan.edu.au/tafe-courses/certificate-iii-in-heavy-commercial-trailer-technology-3241,English,,"You will be advised by your facilitator on a case by case basis in relation to practical and work placement assessments, as some flexibility will be required during this challenging time.This course is designed to give you the knowledge and skills to repair trailers and associated systems, within the Heavy vehicle service and repair sector.Click here for course modulesHow will I be assessed?You will be assessed to show that you have achieved the skills and knowledge required by the course. Assessment may include written, oral or practical assessment methods. You will be advised in advance about the type of assessment and the how it will operate. There is the opportunity for reassessment and appeal and you will be provided with this information.",This course will prepare you to perform mechanical work in the automotive heavy vehicle service and repair sector. This course may lead to employment as a Heavy Commercial Trailer Technician.,Australia,Yes,Yes,Yes,Yes,Yes,,,No,AURAEA002 Follow environmental and sustainability best practice in an automotive workplace ,Nominal Hours = 25,,AURASA002 Follow safe working practices in an automotive workplace ,Nominal Hours = 20,,AURETR009 Install vehicle lighting and wiring systems ,Nominal Hours = 40,,AURETR012 Test and repair basic electrical circuits ,Nominal Hours = 40,,AURETR022 Diagnose and repair vehicle dynamic control systems ,Nominal Hours = 70,,AURHTB001 Diagnose and repair heavy vehicle air braking systems ,Nominal Hours = 50,,AURHTD003 Diagnose and repair heavy commercial vehicle suspension systems ,Nominal Hours = 40,,"AURHTJ003 Remove, inspect and refit heavy vehicle wheel and tyre assemblies ",Nominal Hours = 20,,AURHTY002 Diagnose and repair mechanical connections of heavy vehicles and trailers over 4.5 tonnes ,Nominal Hours = 15,,AURTTA018 Carry out diagnostic procedures ,Nominal Hours = 20,,AURTTK002 Use and maintain tools and equipment in an automotive workplace ,Nominal Hours = 20,,"AURATA002 Read, interpret and apply engineering drawings ",Nominal Hours = 40,,AURETR010 Repair wiring harnesses and looms ,Nominal Hours = 40,,AURETR011 Install basic ancillary electrical systems and components ,Nominal Hours = 40,,"AURETR025 Test, charge and replace batteries and jump-start vehicles ",Nominal Hours = 15,,AURETR032 Diagnose and repair automotive electrical systems ,Nominal Hours = 80,,AURHTB002 Diagnose and repair heavy vehicle hydraulic and air over hydraulic braking systems ,Nominal Hours = 40,,AURHTQ003 Diagnose and repair heavy vehicle drive shafts ,Nominal Hours = 30,,AURHTR005 Diagnose and repair heavy commercial trailer electronically controlled roll stability systems ,Nominal Hours = 25,,AURHTY001 Inspect and service mechanical connections of heavy vehicles and trailers over 4.5 tonnes ,Nominal Hours = 5,,AURTTA004 Carry out servicing operations ,Nominal Hours = 20,,AURTTA006 Inspect and service hydraulic systems ,Nominal Hours = 20,,AURTTA011 Install hydraulic systems to specified applications ,Nominal Hours = 74,,AURTTA012 Fabricate and install fluid power hose assemblies ,Nominal Hours = 10,,AURTTA013 Diagnose and repair hydraulic systems ,Nominal Hours = 60,,AURTTA3013 Repair Hydraulic Systems ,Nominal Hours = 60,,AURTTB001 Inspect and service braking systems ,Nominal Hours = 20,,AURTTB004 Inspect and service air braking systems ,Nominal Hours = 20,,AURTTB005 Assemble and fit braking system components ,Nominal Hours = 80,,"AURTTB006 Inspect, service and repair auxiliary braking systems ",Nominal Hours = 20,,AURTTD004 Inspect and service suspension systems ,Nominal Hours = 10,,AURTTJ001 Balance wheels and tyres ,Nominal Hours = 10,,AURTTK001 Use and maintain measuring equipment in an automotive workplace ,Nominal Hours = 15,,AURVTW001 Carry out manual metal arc welding on components ,Nominal Hours = 30,,AURVTW004 Carry out tungsten inert gas welding ,Nominal Hours = 30,,AURVTW007 Carry out oxyacetylene thermal heating and cutting on vehicle body sections ,Nominal Hours = 20,,"AURVTW008 Carry out oxyacetylene welding, thermal heating and cutting ",Nominal Hours = 30,,AURVTW009 Carry out basic gas metal arc welding ,Nominal Hours = 20,,,,,,,
CERTIII,Kangan Batman Institute,Online,Certificate III in Heavy Commercial Trailer Technology,Heavy Commercial Vehicles & Engine Techn,1144,227,5866,1144,227,5866,AUD,Years,3.0,Years,Yes,Yes,ATAR,IELTS,,,,,https://www.kangan.edu.au/tafe-courses/certificate-iii-in-heavy-commercial-trailer-technology-3241,English,,"You will be advised by your facilitator on a case by case basis in relation to practical and work placement assessments, as some flexibility will be required during this challenging time.This course is designed to give you the knowledge and skills to repair trailers and associated systems, within the Heavy vehicle service and repair sector.Click here for course modulesHow will I be assessed?You will be assessed to show that you have achieved the skills and knowledge required by the course. Assessment may include written, oral or practical assessment methods. You will be advised in advance about the type of assessment and the how it will operate. There is the opportunity for reassessment and appeal and you will be provided with this information.",This course will prepare you to perform mechanical work in the automotive heavy vehicle service and repair sector. This course may lead to employment as a Heavy Commercial Trailer Technician.,Australia,Yes,Yes,Yes,Yes,Yes,,,No,AURAEA002 Follow environmental and sustainability best practice in an automotive workplace ,Nominal Hours = 25,,AURASA002 Follow safe working practices in an automotive workplace ,Nominal Hours = 20,,AURETR009 Install vehicle lighting and wiring systems ,Nominal Hours = 40,,AURETR012 Test and repair basic electrical circuits ,Nominal Hours = 40,,AURETR022 Diagnose and repair vehicle dynamic control systems ,Nominal Hours = 70,,AURHTB001 Diagnose and repair heavy vehicle air braking systems ,Nominal Hours = 50,,AURHTD003 Diagnose and repair heavy commercial vehicle suspension systems ,Nominal Hours = 40,,"AURHTJ003 Remove, inspect and refit heavy vehicle wheel and tyre assemblies ",Nominal Hours = 20,,AURHTY002 Diagnose and repair mechanical connections of heavy vehicles and trailers over 4.5 tonnes ,Nominal Hours = 15,,AURTTA018 Carry out diagnostic procedures ,Nominal Hours = 20,,AURTTK002 Use and maintain tools and equipment in an automotive workplace ,Nominal Hours = 20,,"AURATA002 Read, interpret and apply engineering drawings ",Nominal Hours = 40,,AURETR010 Repair wiring harnesses and looms ,Nominal Hours = 40,,AURETR011 Install basic ancillary electrical systems and components ,Nominal Hours = 40,,"AURETR025 Test, charge and replace batteries and jump-start vehicles ",Nominal Hours = 15,,AURETR032 Diagnose and repair automotive electrical systems ,Nominal Hours = 80,,AURHTB002 Diagnose and repair heavy vehicle hydraulic and air over hydraulic braking systems ,Nominal Hours = 40,,AURHTQ003 Diagnose and repair heavy vehicle drive shafts ,Nominal Hours = 30,,AURHTR005 Diagnose and repair heavy commercial trailer electronically controlled roll stability systems ,Nominal Hours = 25,,AURHTY001 Inspect and service mechanical connections of heavy vehicles and trailers over 4.5 tonnes ,Nominal Hours = 5,,AURTTA004 Carry out servicing operations ,Nominal Hours = 20,,AURTTA006 Inspect and service hydraulic systems ,Nominal Hours = 20,,AURTTA011 Install hydraulic systems to specified applications ,Nominal Hours = 74,,AURTTA012 Fabricate and install fluid power hose assemblies ,Nominal Hours = 10,,AURTTA013 Diagnose and repair hydraulic systems ,Nominal Hours = 60,,AURTTA3013 Repair Hydraulic Systems ,Nominal Hours = 60,,AURTTB001 Inspect and service braking systems ,Nominal Hours = 20,,AURTTB004 Inspect and service air braking systems ,Nominal Hours = 20,,AURTTB005 Assemble and fit braking system components ,Nominal Hours = 80,,"AURTTB006 Inspect, service and repair auxiliary braking systems ",Nominal Hours = 20,,AURTTD004 Inspect and service suspension systems ,Nominal Hours = 10,,AURTTJ001 Balance wheels and tyres ,Nominal Hours = 10,,AURTTK001 Use and maintain measuring equipment in an automotive workplace ,Nominal Hours = 15,,AURVTW001 Carry out manual metal arc welding on components ,Nominal Hours = 30,,AURVTW004 Carry out tungsten inert gas welding ,Nominal Hours = 30,,AURVTW007 Carry out oxyacetylene thermal heating and cutting on vehicle body sections ,Nominal Hours = 20,,"AURVTW008 Carry out oxyacetylene welding, thermal heating and cutting ",Nominal Hours = 30,,AURVTW009 Carry out basic gas metal arc welding ,Nominal Hours = 20,,,,,,,
CERTIII,Kangan Batman Institute,Melbourne,Certificate III in Heavy Commercial Vehicle Mechanical Technology,Heavy Commercial Vehicles & Engine Techn,3858,767,20119,3858,767,20119,AUD,Years,3.0,Years,Yes,Yes,ATAR,IELTS,,,,,https://www.kangan.edu.au/tafe-courses/certificate-iii-in-heavy-commercial-vehicle-mechanical-technology-3143,English,,"You will be advised by your facilitator on a case by case basis in relation to practical and work placement assessments, as some flexibility will be required during this challenging time.This course will train you to work in the heavy vehicle industry. You will gain the skills and knowledge to competently carry out service, repair and diagnostic procedures.Click here for course modulesHow will I be assessed?You will be assessed to show that you have achieved the skills and knowledge required by the course. Assessment may include written, oral or practical assessment methods. You will be advised in advance about the type of assessment and the how it will operate. There is the opportunity for reassessment and appeal and you will be provided with this information.",This course is intended to prepare you to perform mechanical work in the automotive heavy commercial vehicle service and repair sector. This course may lead to employment as a:• Heavy Commercial Vehicle Technician• Service Adviser,Australia,Yes,Yes,Yes,Yes,Yes,,,No,AURAEA002 Follow environmental and sustainability best practice in an automotive workplace ,Nominal Hours = 25,,AURASA002 Follow safe working practices in an automotive workplace ,Nominal Hours = 20,,AURETR012 Test and repair basic electrical circuits ,Nominal Hours = 40,,AURETR022 Diagnose and repair vehicle dynamic control systems ,Nominal Hours = 70,,AURETR024 Diagnose and repair compression ignition engine management systems ,Nominal Hours = 50,,"AURETR025 Test, charge and replace batteries and jump-start vehicles ",Nominal Hours = 15,,AURETR029 Diagnose and repair charging systems ,Nominal Hours = 30,,AURETR030 Diagnose and repair starting systems ,Nominal Hours = 30,,AURHTB001 Diagnose and repair heavy vehicle air braking systems ,Nominal Hours = 50,,AURHTD002 Diagnose and repair heavy commercial vehicle steering systems ,Nominal Hours = 40,,AURHTD003 Diagnose and repair heavy commercial vehicle suspension systems ,Nominal Hours = 40,,AURHTE002 Diagnose and repair heavy vehicle compression ignition engines ,Nominal Hours = 70,,AURHTQ003 Diagnose and repair heavy vehicle drive shafts ,Nominal Hours = 30,,AURHTZ001 Diagnose and repair heavy vehicle emission control systems ,Nominal Hours = 20,,AURTTA004 Carry out servicing operations ,Nominal Hours = 20,,AURTTA006 Inspect and service hydraulic systems ,Nominal Hours = 20,,AURTTA018 Carry out diagnostic procedures ,Nominal Hours = 20,,AURTTC003 Diagnose and repair cooling systems ,Nominal Hours = 20,,AURTTF002 Inspect and service diesel fuel injection systems ,Nominal Hours = 20,,AURTTF005 Diagnose and repair engine forced-induction systems ,Nominal Hours = 15,,AURTTK002 Use and maintain tools and equipment in an automotive workplace ,Nominal Hours = 20,,AURTTQ001 Inspect and service final drive assemblies ,Nominal Hours = 5,,"AUMGTM007 Assemble, Install And Test Pneumatic System Kits ",Nominal Hours = 40,,AUMGTP001 Finish And Paint Vehicle Body And Part Surfaces ,Nominal Hours = 20,,AURETR006 Solder electrical wiring and circuits ,Nominal Hours = 20,,AURETR010 Repair wiring harnesses and looms ,Nominal Hours = 40,,AURETR011 Install basic ancillary electrical systems and components ,Nominal Hours = 40,,AURETR043 Diagnose and repair electronic body management systems ,Nominal Hours = 40,,AURETR044 Diagnose and repair integrated engine and transmission management systems ,Nominal Hours = 50,,AURETU001 Install air conditioning systems ,Nominal Hours = 30,,AURETU003 Service air conditioning and HVAC systems ,Nominal Hours = 25,,AURETU004 Diagnose and repair air conditioning and HVAC systems ,Nominal Hours = 35,,AURETU005 Retrofit and modify air conditioning and HVAC systems ,Nominal Hours = 30,,AURHTB002 Diagnose and repair heavy vehicle hydraulic and air over hydraulic braking systems ,Nominal Hours = 40,,AURHTB007 Diagnose and repair heavy commercial vehicle electronic braking systems ,Nominal Hours = 40,,AURHTD001 Inspect heavy commercial vehicle suspension systems ,Nominal Hours = 10,,AURHTE001 Remove and install heavy vehicle engine assemblies ,Nominal Hours = 35,,AURHTF002 Diagnose and repair heavy vehicle diesel fuel injection systems ,Nominal Hours = 80,,"AURHTJ003 Remove, inspect and refit heavy vehicle wheel and tyre assemblies ",Nominal Hours = 20,,AURHTQ001 Inspect heavy commercial vehicle driveline components ,Nominal Hours = 5,
