Level_Code,University,City,Course,Faculty,Non-Apprentice_Government_Subsidised_Fee,Non-Apprentice_Concession_Fees,Non-Apprentice_Full_Fees,Apprentice_Government_Subsidised_Fee,Apprentice_Concession_Fees,Apprentice_Full_Fees,Currency,Currency_Time,Duration,Duration_Time,Full_Time,Part_Time,Prerequisite_1,Prerequisite_2,Prerequisite_3,Prerequisite_1_grade_1,Prerequisite_2_grade_2,Prerequisite_3_grade_3,Website,Course_Lang,Availability,Description,Career_Outcomes/path,Country,Online,Offline,Distance,Face_to_Face,Blended,Remarks,Course Delivery Mode,FREE TAFE,Subject_or_Unit_1,Subject_Objective_1,Subject_Description_1,Subject_or_Unit_2,Subject_Objective_2,Subject_Description_2,Subject_or_Unit_3,Subject_Objective_3,Subject_Description_3,Subject_or_Unit_4,Subject_Objective_4,Subject_Description_4,Subject_or_Unit_5,Subject_Objective_5,Subject_Description_5,Subject_or_Unit_6,Subject_Objective_6,Subject_Description_6,Subject_or_Unit_7,Subject_Objective_7,Subject_Description_7,Subject_or_Unit_8,Subject_Objective_8,Subject_Description_8,Subject_or_Unit_9,Subject_Objective_9,Subject_Description_9,Subject_or_Unit_10,Subject_Objective_10,Subject_Description_10,Subject_or_Unit_11,Subject_Objective_11,Subject_Description_11,Subject_or_Unit_12,Subject_Objective_12,Subject_Description_12,Subject_or_Unit_13,Subject_Objective_13,Subject_Description_13,Subject_or_Unit_14,Subject_Objective_14,Subject_Description_14,Subject_or_Unit_15,Subject_Objective_15,Subject_Description_15,Subject_or_Unit_16,Subject_Objective_16,Subject_Description_16,Subject_or_Unit_17,Subject_Objective_17,Subject_Description_17,Subject_or_Unit_18,Subject_Objective_18,Subject_Description_18,Subject_or_Unit_19,Subject_Objective_19,Subject_Description_19,Subject_or_Unit_20,Subject_Objective_20,Subject_Description_20,Subject_or_Unit_21,Subject_Objective_21,Subject_Description_21,Subject_or_Unit_22,Subject_Objective_22,Subject_Description_22,Subject_or_Unit_23,Subject_Objective_23,Subject_Description_23,Subject_or_Unit_24,Subject_Objective_24,Subject_Description_24,Subject_or_Unit_25,Subject_Objective_25,Subject_Description_25,Subject_or_Unit_26,Subject_Objective_26,Subject_Description_26,Subject_or_Unit_27,Subject_Objective_27,Subject_Description_27,Subject_or_Unit_28,Subject_Objective_28,Subject_Description_28,Subject_or_Unit_29,Subject_Objective_29,Subject_Description_29,Subject_or_Unit_30,Subject_Objective_30,Subject_Description_30,Subject_or_Unit_31,Subject_Objective_31,Subject_Description_31,Subject_or_Unit_32,Subject_Objective_32,Subject_Description_32,Subject_or_Unit_33,Subject_Objective_33,Subject_Description_33,Subject_or_Unit_34,Subject_Objective_34,Subject_Description_34,Subject_or_Unit_35,Subject_Objective_35,Subject_Description_35,Subject_or_Unit_36,Subject_Objective_36,Subject_Description_36,Subject_or_Unit_37,Subject_Objective_37,Subject_Description_37,Subject_or_Unit_38,Subject_Objective_38,Subject_Description_38,Subject_or_Unit_39,Subject_Objective_39,Subject_Description_39,Subject_or_Unit_40,Subject_Objective_40,Subject_Description_40
ADIP,Kangan Batman Institute,Melbourne,Advanced Diploma Of Accounting,"Professional, Creative & Environment",5880,1176,8526,,,,AUD,Years,6.0,Months,Yes,Yes,ATAR,IELTS,,,,,https://www.kangan.edu.au/tafe-courses/advanced-diploma-of-accounting-3335,English,,"The Advanced Diploma of Accounting (FNS60217) is designed to enrich your knowledge of taxation, corporate law and financial reporting. The course is nationally accredited and will give you the educational units required to become a registered Tax Agent.Our experienced teachers who are experts in their field will guide you through the program. You'll gain the skills and confidence to perform a range of advanced accounts management tasks including:Satisfactory completion of this course entitles you to join the Institute of Public Accountants (IPA), one of the three peak accounting bodies representing accountants in Australia.Free TAFE and JobTrainerYou may be entitled to free tuition fees for this course if you meet the eligibility criteria for the State Government’s FREE TAFE for Priority Courses initiative. If you are aged 17-24 or looking for work, you may be eligible to study this course low-fee through JobTrainer. It's important to know that you may incur other fees, such as student services fees or materials fees, and you'll need to cover these costs yourself. To find out more, call 13 TAFE (13 8233) or contact us via our online enquiry form.After completing this course, you can go on to undertake a Bachelor of Business or Bachelor of Commerce. Our partnerships with leading Australian universities entitle graduates of this course to earn credits towards a degree. Learn more about university pathways here.Kangan Insitute also offers the following accounting courses:Our course experts will be more than happy to answer any questions you have. To find out more, call 13 TAFE (13 8233) or contact us via our online enquiry form.* Visit the Australian Government Tax Practitioner Board website for more information about the eligibility requirements for becoming a Tax Agent.Click here for course modulesHow will I be assessed?You will be assessed to show that you have achieved the skills and knowledge required by the course. Assessments may include written, oral or practical assessment methods. You will know in advance about the type of assessment and how it will operate. There is the opportunity for reassessment and appeal. You will be given this information at course orientation.What will I study?You will learn about:",Job prospects for graduates of this course include: Accountant Insolvency practitioner Tax agent Accounts manager Business analyst,Australia,No,Yes,No,Yes,No,,,Yes,FNSACC624 Monitor corporate governance activities ,Nominal Hours = 60,,FNSINC601 Apply economic principles to work in the financial services industry ,Nominal Hours = 60,,FNSINC602 Interpret and use financial statistics and tools ,Nominal Hours = 60,,FNSACC601 Prepare and administer tax documentation for legal entities ,Nominal Hours = 80,,FNSACC602 Audit and report on financial systems and records ,Nominal Hours = 40,,FNSACC603 Implement tax plans and evaluate tax obligations ,Nominal Hours = 60,,FNSACC608 Evaluate organisation's financial performance ,Nominal Hours = 60,,FNSACC613 Prepare and analyse management accounting information ,Nominal Hours = 60,,FNSTPB505 Apply legal principles in property law ,Nominal Hours = 60,,,,,,,,,,,,,,,,,,,,,,,,,,,,,,,,,,,,,,,,,,,,,,,,,,,,,,,,,,,,,,,,,,,,,,,,,,,,,,,,,,,,,,,,,,,,,,
ADIP,Kangan Batman Institute,Melbourne,Advanced Diploma Of Applied Fashion Design And Merchandising,Creative Industries,15498,3105,30429,,,,AUD,Years,1.0,Year,Yes,Yes,ATAR,IELTS,,,,,https://www.kangan.edu.au/tafe-courses/advanced-diploma-of-applied-fashion-design-and-merchandising-3362,English,,"Click here for course modulesHow will I be assessed?You will be assessed to show that you have achieved the skills and knowledge required by the course. Assessment may include written, oral or practical assessment methods. You will know in advance about the type of assessment and how it will operate. There is the opportunity for reassessment and appeal and you will be given this information.What will I study?You will study a variety of areas withing the Fashion Industry framework that will assist you so that you are successful and job ready for the fashion industry. You will learn how to design a complete capsule 'Signature Collection' and have the opportunity to be selected to showcase in Melbourne Fashion Week. Advanced Pattern making including digital pattern making -Stylecad, CAD (Computer Aided Design), textiles, advanced construction techniques and all aspects of fashion business; including commercial design, business strategy, business planning, sustainable fashion and working with supply chains are part of the curriculum. You will gain the knowledge and skills to develop and manage a career in the fashion industry, both established and emerging.  We offer students a variety of real-life industry experiences so that they are career-ready when they graduate. Students will have opportunities to apply their studies by partaking in sought-after internships around Melbourne.","This course may lead to  employment as a Fashion Designer, Advanced Patternmaker, Grader, Production Manager, Quality Coordinator Technical Designer, Garment Technician , small business operator, Fashion buyer, Fashion Journalist , Coutourier, Ready to wear designer, Product Developer , Marketing and MerchandisinG, Illustrator, Supply Chain and Sustainable Fashion.",Australia,No,Yes,No,Yes,No,,,No,MSTFD4002 Apply principles of colour theory to fashion design development ,Nominal Hours = 0,,"MSTGN2011 Identify fibres, fabrics and textiles used in the TCF industry ",Nominal Hours = 0,,BSBMKG414 Undertake Marketing Activities ,Nominal Hours = 0,,CUVPRP501A Realise A Body Of Creative Work ,Nominal Hours = 0,,MSTFD5001 Design bras and swimwear ,Nominal Hours = 0,,MSTFD5002 Develop and test patterns for bras and swimwear ,Nominal Hours = 0,,MSTFD5006 Evaluate fashion designs against set criteria ,Nominal Hours = 0,,MSTFD5012 Perform contour draping ,Nominal Hours = 0,,MSTFD5013 Develop merchandising plans for fashion products ,Nominal Hours = 0,,MSTFD5019 Analyse individual fit and make pattern alterations ,Nominal Hours = 0,,MSTFD5020 Assess impact of current fashion industry innovations and practices ,Nominal Hours = 0,,MSTFD6005 Drape structured over-garments ,Nominal Hours = 0,,MSTFD6007 Implement specialised patternmaking technologies ,Nominal Hours = 0,,MSTGN5005 Provide global operations support ,Nominal Hours = 0,,MSTGN6002 Manage quality system and procedures ,Nominal Hours = 0,,MSTGN6005 Manage production processes ,Nominal Hours = 0,,MSTTD4001 Produce knitted textile samples ,Nominal Hours = 0,,MSTTD5001 Design and produce knitted textile products ,Nominal Hours = 0,,MSTTD5004 Design and produce experimental textiles ,Nominal Hours = 0,,MSTTD6001 Research commercial development of textiles ,Nominal Hours = 0,,MSTTD6002 Apply electronic systems to textile design and production ,Nominal Hours = 0,,MSTTD6003 Develop a textile product range ,Nominal Hours = 0,,SIRXEBS002A Manage Retail Brands Online ,Nominal Hours = 0,,BSBMGT617 Develop And Implement A Business Plan ,Nominal Hours = 60,,BSBMKG510 Plan E-marketing Communications ,Nominal Hours = 20,,CUAPPR603 Engage in the business of creative practice ,Nominal Hours = 70,,MSMENV272 Participate in environmentally sustainable work practices ,Nominal Hours = 30,,MSTFD4018 Use and apply sizing systems appropriate for fashion design ,Nominal Hours = 20,,MSTFD5018 Determine and specify advanced construction processes ,Nominal Hours = 100,,MSTFD5021 Conduct digital patternmaking and grading ,Nominal Hours = 150,,MSTFD5022 Develop digital costing markers ,Nominal Hours = 130,,MSTFD6001 Evaluate commercial viability of designs ,Nominal Hours = 50,,MSTFD6002 Manage product development of fashion designs ,Nominal Hours = 60,,MSTFD6003 Manage fashion design process ,Nominal Hours = 80,,MSTFD6004 Manage advanced patternmaking processes ,Nominal Hours = 100,,MSTFD6006 Develop a fashion range ,Nominal Hours = 100,,MSTFD6008 Apply studio processes to create and produce designs for commercial production ,Nominal Hours = 100,,MSTFD6009 Analyse fashion industry textiles to guide commercial development ,Nominal Hours = 60,,MSTGN5011 Work with international TCF supply chains ,Nominal Hours = 60,,MSTGN6001 Develop and implement a sales or marketing strategy for fashion or textile items ,Nominal Hours = 60,
ADIP,Kangan Batman Institute,Melbourne,Advanced Diploma of Computer Systems Technology,INFORMATION COMMUNICATION TECHNOLOGY,9559,1911,18694,,,,AUD,Years,1.0,Year,Yes,No,ATAR,IELTS,,,,,https://www.kangan.edu.au/tafe-courses/advanced-diploma-of-computer-systems-technology-2991,English,,"If you are looking to build on your existing skills and take the next step in your information and communications technology (ICT career), we can help you get there.Our Advanced Diploma of Computer Systems Technology will prepare you to work as an ICT specialist or as part of a team.This ICT course equips participants with the skills and knowledge to coordinate and administer the installation, commissioning and ongoing maintenance of a range of networks, enterprise servers and systems, including inter-networking, security and e-business solutions.University pathwayWhen you graduate from the Advanced Diploma of Computer Systems Technology (ICT60515), you'll be eligible for guaranteed entry into the Bachelor of Information Technology at La Trobe University (Bundoora) and 120 credits (which is equivalent to 1 year study).Click here for course modulesHow will I be assessed?You will be assessed to show that you have achieved the skills and knowledge required by the course. Assessment may include written, oral or practical assessment methods. You will know in advance about the type of assessment and how it will operate. There is the opportunity for reassessment and appeal and you will be given this information.Additional commentsRegister for an information session to find out more about the course. To view the latest information session click here.Please bring your Medicare card, a photo ID and concession card (if applicable) to confirm enrolment. This information and enrolment session will take approximately 3 hoursWhat will I study?For a listing of the course subjects, please click on the course module listing link in the Course Overview section.",This course may lead to employment in the ICT industry within a variety of roles including: Network engineer enterprise systems administrator Systems developer network Services administrator Network security administrator,Australia,Yes,Yes,Yes,Yes,Yes,,,No,"ICTNWK506 Configure, verify and troubleshoot WAN links and IP services in a medium enterprise network ",Nominal Hours = 90,,"ICTNWK507 Install, operate and troubleshoot medium enterprise routers ",Nominal Hours = 120,,"ICTNWK508 Install, operate and troubleshoot medium enterprise switches ",Nominal Hours = 90,,ICTNWK509 Design and implement a security perimeter for ICT networks ,Nominal Hours = 60,,ICTNWK529 Install and manage complex ICT networks ,Nominal Hours = 100,,ICTNWK607 Design and implement wireless network security ,Nominal Hours = 60,,ICTPMG608 Manage ICT project systems implementation ,Nominal Hours = 40,,ICTPMG609 Plan and direct complex ICT projects ,Nominal Hours = 80,,ICTPRG527 Apply intermediate object-oriented language skills ,Nominal Hours = 60,,ICTWEB501 Build a dynamic website ,Nominal Hours = 60,,ICTWEB502 Create dynamic web pages ,Nominal Hours = 40,,ICTDBS502 Design a database ,Nominal Hours = 50,,ICTICT502 Develop detailed component specifications from project specifications ,Nominal Hours = 40,,ICTICT609 Lead the evaluation and implementation of current industry specific technologies ,Nominal Hours = 80,,ICTNWK504 Design and implement an integrated server solution ,Nominal Hours = 50,,"ICTNWK505 Design, build and test a network server ",Nominal Hours = 50,,ICTNWK525 Configure an enterprise virtual computing environment ,Nominal Hours = 60,,ICTNWK527 Manage an enterprise virtual computing environment ,Nominal Hours = 60,,"ICTNWK602 Plan, configure and test advanced server-based security ",Nominal Hours = 80,,ICTNWK614 Manage ICT security ,Nominal Hours = 80,,ICTPRG501 Apply advanced object-oriented language skills ,Nominal Hours = 80,,ICTWEB503 Create web-based programs ,Nominal Hours = 60,,ICTWEB505 Develop complex web page layouts ,Nominal Hours = 40,,,,,,,,,,,,,,,,,,,,,,,,,,,,,,,,,,,,,,,,,,,,,,,,,,,,
ADIP,Kangan Batman Institute,Online,Advanced Diploma of Computer Systems Technology,INFORMATION COMMUNICATION TECHNOLOGY,9559,1911,18694,,,,AUD,Years,1.0,Year,Yes,No,ATAR,IELTS,,,,,https://www.kangan.edu.au/tafe-courses/advanced-diploma-of-computer-systems-technology-2991,English,,"If you are looking to build on your existing skills and take the next step in your information and communications technology (ICT career), we can help you get there.Our Advanced Diploma of Computer Systems Technology will prepare you to work as an ICT specialist or as part of a team.This ICT course equips participants with the skills and knowledge to coordinate and administer the installation, commissioning and ongoing maintenance of a range of networks, enterprise servers and systems, including inter-networking, security and e-business solutions.University pathwayWhen you graduate from the Advanced Diploma of Computer Systems Technology (ICT60515), you'll be eligible for guaranteed entry into the Bachelor of Information Technology at La Trobe University (Bundoora) and 120 credits (which is equivalent to 1 year study).Click here for course modulesHow will I be assessed?You will be assessed to show that you have achieved the skills and knowledge required by the course. Assessment may include written, oral or practical assessment methods. You will know in advance about the type of assessment and how it will operate. There is the opportunity for reassessment and appeal and you will be given this information.Additional commentsRegister for an information session to find out more about the course. To view the latest information session click here.Please bring your Medicare card, a photo ID and concession card (if applicable) to confirm enrolment. This information and enrolment session will take approximately 3 hoursWhat will I study?For a listing of the course subjects, please click on the course module listing link in the Course Overview section.",This course may lead to employment in the ICT industry within a variety of roles including: Network engineer enterprise systems administrator Systems developer network Services administrator Network security administrator,Australia,Yes,Yes,Yes,Yes,Yes,,,No,"ICTNWK506 Configure, verify and troubleshoot WAN links and IP services in a medium enterprise network ",Nominal Hours = 90,,"ICTNWK507 Install, operate and troubleshoot medium enterprise routers ",Nominal Hours = 120,,"ICTNWK508 Install, operate and troubleshoot medium enterprise switches ",Nominal Hours = 90,,ICTNWK509 Design and implement a security perimeter for ICT networks ,Nominal Hours = 60,,ICTNWK529 Install and manage complex ICT networks ,Nominal Hours = 100,,ICTNWK607 Design and implement wireless network security ,Nominal Hours = 60,,ICTPMG608 Manage ICT project systems implementation ,Nominal Hours = 40,,ICTPMG609 Plan and direct complex ICT projects ,Nominal Hours = 80,,ICTPRG527 Apply intermediate object-oriented language skills ,Nominal Hours = 60,,ICTWEB501 Build a dynamic website ,Nominal Hours = 60,,ICTWEB502 Create dynamic web pages ,Nominal Hours = 40,,ICTDBS502 Design a database ,Nominal Hours = 50,,ICTICT502 Develop detailed component specifications from project specifications ,Nominal Hours = 40,,ICTICT609 Lead the evaluation and implementation of current industry specific technologies ,Nominal Hours = 80,,ICTNWK504 Design and implement an integrated server solution ,Nominal Hours = 50,,"ICTNWK505 Design, build and test a network server ",Nominal Hours = 50,,ICTNWK525 Configure an enterprise virtual computing environment ,Nominal Hours = 60,,ICTNWK527 Manage an enterprise virtual computing environment ,Nominal Hours = 60,,"ICTNWK602 Plan, configure and test advanced server-based security ",Nominal Hours = 80,,ICTNWK614 Manage ICT security ,Nominal Hours = 80,,ICTPRG501 Apply advanced object-oriented language skills ,Nominal Hours = 80,,ICTWEB503 Create web-based programs ,Nominal Hours = 60,,ICTWEB505 Develop complex web page layouts ,Nominal Hours = 40,,,,,,,,,,,,,,,,,,,,,,,,,,,,,,,,,,,,,,,,,,,,,,,,,,,,
ADIP,Kangan Batman Institute,Melbourne,Advanced Diploma Of Justice,Community CoE,3944,788,7167,,,,AUD,Years,1.0,Year,Yes,No,ATAR,IELTS,,,,,https://www.kangan.edu.au/tafe-courses/advanced-diploma-of-justice-3273,English,,"The Advanced Diploma of Justice equips you with skills for employment in supervisory or management positions within the justice industry.This justice course will provide you with knowledge about the Australian criminal justice system and the social and legal context in which it operates.When you graduate with the Advanced Diploma of Justice, you will be equipped with a high standard of justice skills, enabling you to move into a Bachelor’s degree; including Bachelor of Arts degree and Bachelor of Social Science with applicable credits.Click here for course modulesHow will I be assessed?You will be assessed to show that you have achieved the skills and knowledge required by the course. Assessment may include written, oral or practical assessment methods. You will know in advance about the type of assessment and how it will operate. There is the opportunity for reassessment and appeal and you will be given this information.Additional commentsNon-VTAC applicants and applicants who have not completed the Diploma of Justice at Kangan Institute will be required to attend an information session. These information sessions will cover course requirements, fees, timetables and an entrance test. Teachers will be presenting during these information sessions and available to answer questions as required.What will I study?You will be required to study eight core units and four elective units. Please see the list of modules for more details.","Students qualified with the Advanced Diploma of Justice will have high level skills to enter a range of justice careers, including supervisory or management positions within the justice industry such as the state or federal police forces, customs service, sheriff’s department, local government, correctional services, courts, youth justice, community corrections and various non-government organisations.",Australia,No,Yes,No,Yes,No,,,No,VU21922 Apply research techniques within justice contexts ,Nominal Hours = 60,,VU21923 Apply investigative processes within justice environments ,Nominal Hours = 80,,VU21924 Apply sociology concepts and principles to justice contexts ,Nominal Hours = 50,,VU21925 Research criminology and crime prevention for application to practice within justice environments ,Nominal Hours = 80,,VU21926 Research human rights principles within justice environments ,Nominal Hours = 50,,VU21927 Apply psychological concepts and principles within justice environments ,Nominal Hours = 50,,VU21928 Identify and respond to client complex issues within a criminal justice environment ,Nominal Hours = 50,,VU21929 Undertake case-management in a justice environment ,Nominal Hours = 50,,VU21635 Define and evaluate law of evidence ,Nominal Hours = 50,,VU21930 Apply law and advocacy to support justice clients experiencing justiciable event/s ,Nominal Hours = 50,,VU21931 Work with young offenders in justice environments ,Nominal Hours = 50,,VU21932 Analyse the child protection environment in a justice context ,Nominal Hours = 60,,,,,,,,,,,,,,,,,,,,,,,,,,,,,,,,,,,,,,,,,,,,,,,,,,,,,,,,,,,,,,,,,,,,,,,,,,,,,,,,,,,,,
